approach,"<section class=""gramb""><h3 class=""ps pos""><span class=""pos"">verb</span></h3><span class=""transitivity""><span class=""neutral"">[</span>with object<span class=""neutral"">]</span></span><ul class=""semb""><li><div class=""trg""><p><span class=""iteration"">1</span><span class=""ind"">Come near or nearer to (someone or something) in distance or time.</span></p><span class=""indicators""></span><div class=""exg""><div class=""ex""><em>‘the train approached the main line’</em></div></div><div class=""exg""><div class=""ex""><u><span class=""grammatical_note"">no object</span></u> <em>‘winter was approaching’</em></div></div><div class=""synonyms""><div class=""moreInfo""></div><div class=""exg""><div><strong class=""syn"">proceed towards</strong><span class=""syn"">, come towards, go towards, advance towards, go near, go nearer, come near, come nearer, draw near, draw nearer, come close, come closer, go close, go closer, draw close, draw closer, move near, move nearer, edge near, edge nearer, near, draw near</span></div></div></div><p><ul class=""subSenses""><li class=""subSense""><span class=""subsenseIteration"">1.1</span><span class=""ind"">Come close to (a number, level, or standard) in quality or quantity.</span><div class=""trg""></div><div class=""exg""><div class=""ex""><em>‘the population will approach 12 million by the end of the decade’</em></div></div><div class=""synonyms""><div class=""moreInfo""></div><div class=""exg""><div><strong class=""syn"">border on</strong><span class=""syn"">, approximate, verge on, resemble</span></div></div></div></li><li class=""subSense""><span class=""subsenseIteration"">1.2</span><span class=""sense-registers"">archaic </span><span class=""ind"">Bring nearer.</span><div class=""trg""></div><div class=""exg""><div class=""ex""><em>‘all those changes shall serve to approach him the faster to the blest mansion’</em></div></div></li></ul></p></div></li><li><div class=""trg""><p><span class=""iteration"">2</span><span class=""ind"">Speak to (someone) for the first time about a proposal or request.</span></p><span class=""indicators""></span><div class=""exg""><div class=""ex""><em>‘the department had been approached about funding’</em></div></div><div class=""synonyms""><div class=""moreInfo""></div><div class=""exg""><div><strong class=""syn"">speak to</strong><span class=""syn"">, talk to, make conversation with, engage in conversation</span></div></div></div></div></li><li><div class=""trg""><p><span class=""iteration"">3</span><span class=""ind"">Start to deal with (a situation or problem) in a certain way.</span></p><span class=""indicators""></span><div class=""exg""><div class=""ex""><em>‘one must approach the matter with caution’</em></div></div><div class=""synonyms""><div class=""moreInfo""></div><div class=""exg""><div><strong class=""syn"">set about</strong><span class=""syn"">, tackle, begin, start, commence, embark on, make a start on, address oneself to, undertake, get down to, launch into, go about, get to grips with</span></div></div></div></div></li></ul></section><hr><section class=""gramb""><h3 class=""ps pos""><span class=""pos"">noun</span></h3><span class=""transitivity""></span><ul class=""semb""><li><div class=""trg""><p><span class=""iteration"">1</span><span class=""ind"">A way of dealing with a situation or problem.</span></p><span class=""indicators""></span><div class=""exg""><div class=""ex""><em>‘we need a whole new approach to the job’</em></div></div><div class=""synonyms""><div class=""moreInfo""></div><div class=""exg""><div><strong class=""syn"">attitude</strong><span class=""syn"">, slant, perspective, point of view, viewpoint, outlook, line of attack, line of action</span></div></div></div></div></li><li><div class=""trg""><p><span class=""iteration"">2</span><span class=""ind"">An initial proposal or request made to someone.</span></p><span class=""indicators""></span><div class=""exg""><div class=""ex""><em>‘the landowner made an approach to the developer’</em></div></div><div class=""synonyms""><div class=""moreInfo""></div><div class=""exg""><div><strong class=""syn"">proposal</strong><span class=""syn"">, proposition, submission, motion, offer, application, appeal, plea</span></div></div></div><p><ul class=""subSenses""><li class=""subSense""><span class=""subsenseIteration"">2.1</span><span class=""form-groups""><strong>approaches</strong></span><span class=""sense-registers"">dated </span><span class=""ind"">Behaviour intended to propose personal or sexual relations with someone.</span><div class=""trg""></div><div class=""exg""><div class=""ex""><em>‘feminine resistance to his approaches’</em></div></div><div class=""synonyms""><div class=""moreInfo""></div><div class=""exg""><div><strong class=""syn"">advances</strong><span class=""syn"">, overtures, suggestions, attentions</span></div></div></div></li></ul></p></div></li><li><div class=""trg""><p><span class=""iteration"">3</span><u><span class=""grammatical_note"">in singular</span></u> <span class=""ind"">The action of coming near or nearer to someone or something in distance or time.</span></p><span class=""indicators""></span><div class=""exg""><div class=""ex""><em>‘the approach of winter’</em></div></div><div class=""synonyms""><div class=""moreInfo""></div><div class=""exg""><div><strong class=""syn"">advance</strong><span class=""syn"">, coming near, coming nearer, coming, nearing, advent</span></div></div></div><p><ul class=""subSenses""><li class=""subSense""><span class=""subsenseIteration"">3.1</span><span class=""form-groups""><strong>approach to</strong></span><span class=""ind"">An approximation to something.</span><div class=""trg""></div><div class=""exg""><div class=""ex""><em>‘the past is impossible to recall with any approach to accuracy’</em></div></div><div class=""synonyms""><div class=""moreInfo""></div><div class=""exg""><div><strong class=""syn"">approximation</strong><span class=""syn"">, likeness, semblance, correspondence, parallel</span></div></div></div></li><li class=""subSense""><span class=""subsenseIteration"">3.2</span><span class=""ind"">The part of an aircraft's flight in which it descends gradually towards an airfield or runway for landing.</span><div class=""trg""></div><div class=""exg""><div class=""ex""><em>‘the aircraft completed the approach and touched down’</em></div></div><div class=""exg""><div class=""ex""><em>‘I used to trim the plane back to about 50 mph for the final approach’</em></div></div></li><li class=""subSense""><span class=""subsenseIteration"">3.3</span><span class=""form-groups"">usually <strong>approaches</strong></span><span class=""ind"">A road, sea passage, or other way leading to a place.</span><div class=""trg""></div><div class=""exg""><div class=""ex""><em>‘the northern approaches to London’</em></div></div><div class=""synonyms""><div class=""moreInfo""></div><div class=""exg""><div><strong class=""syn"">driveway</strong><span class=""syn"">, drive, access road, road, avenue, street, passageway</span></div></div></div></li></ul></p></div></li></ul></section>"
arrange,"<section class=""gramb""><h3 class=""ps pos""><span class=""pos"">verb</span></h3><span class=""transitivity""><span class=""neutral"">[</span>with object<span class=""neutral"">]</span></span><ul class=""semb""><li><div class=""trg""><p><span class=""iteration"">1</span><span class=""ind"">Put (things) in a neat, attractive, or required order.</span></p><span class=""indicators""></span><div class=""exg""><div class=""ex""><em>‘she had just finished arranging the flowers’</em></div></div><div class=""exg""><div class=""ex""><em>‘the columns are arranged in 12 rows’</em></div></div><div class=""synonyms""><div class=""moreInfo""></div><div class=""exg""><div><strong class=""syn"">put in order</strong><span class=""syn"">, order, set out, lay out, spread out, array, present, put out, display, exhibit, group, sort, organize, tidy, position, dispose</span></div></div></div></div></li><li><div class=""trg""><p><span class=""iteration"">2</span><span class=""ind"">Organize or make plans for (a future event)</span></p><span class=""indicators""></span><div class=""exg""><div class=""ex""><em>‘they hoped to arrange a meeting’</em></div></div><div class=""exg""><div class=""ex""><u><span class=""grammatical_note"">no object</span></u> <em>‘my aunt arranged for the furniture to be stored’</em></div></div><div class=""synonyms""><div class=""moreInfo""></div><div class=""exg""><div><strong class=""syn"">organize</strong><span class=""syn"">, fix, plan, schedule, pencil in, devise, contrive</span></div></div></div><p><ul class=""subSenses""><li class=""subSense""><span class=""subsenseIteration"">2.1</span><u><span class=""grammatical_note"">no object</span></u> <span class=""ind"">Reach agreement about an action or event in advance.</span><div class=""trg""></div><div class=""exg""><div class=""ex""><em>‘I arranged with my boss to have the time off’</em></div></div><div class=""exg""><div class=""ex""><u><span class=""grammatical_note"">with infinitive</span></u> <em>‘they arranged to meet at eleven o'clock’</em></div></div></li><li class=""subSense""><span class=""subsenseIteration"">2.2</span><span class=""ind"">Ensure that (something) is done or provided by organizing it in advance.</span><div class=""trg""></div><div class=""exg""><div class=""ex""><em>‘accommodation can be arranged if required’</em></div></div><div class=""synonyms""><div class=""moreInfo""></div><div class=""exg""><div><strong class=""syn"">prepare</strong><span class=""syn"">, allow, make provision, make preparations, be prepared, anticipate, arrange, make arrangements, get ready, plan, make plans, cater</span></div></div></div></li></ul></p></div></li><li><div class=""trg""><p><span class=""iteration"">3</span><span class=""ind"">Adapt (a musical composition) for performance with instruments or voices other than those originally specified.</span></p><span class=""indicators""></span><div class=""exg""><div class=""ex""><em>‘songs arranged for viola and piano’</em></div></div><div class=""synonyms""><div class=""moreInfo""></div><div class=""exg""><div><strong class=""syn"">adapt</strong><span class=""syn"">, set, score, orchestrate, instrument, harmonize</span></div></div></div></div></li><li><div class=""trg""><p><span class=""iteration"">4</span><span class=""sense-registers"">archaic </span><span class=""ind"">Settle (a dispute or claim)</span></p><span class=""indicators""></span><div class=""exg""><div class=""ex""><em>‘the quarrel, partly by the interference of the Crown Prince, was arranged’</em></div></div><div class=""synonyms""><div class=""moreInfo""></div><div class=""exg""><div><strong class=""syn"">put in order</strong><span class=""syn"">, sort out, straighten out, tidy up, order, arrange, organize, adjust, clear up, set to rights, regulate, systematize</span></div></div></div></div></li></ul></section>"
arrival,"<section class=""gramb""><h3 class=""ps pos""><span class=""pos"">noun</span></h3><u><span class=""grammatical_note countability"">mass noun</span></u><span class=""transitivity""></span><ul class=""semb""><li><div class=""trg""><p><span class=""iteration"">1</span><span class=""ind"">The action or process of arriving.</span></p><span class=""indicators""></span><div class=""exg""><div class=""ex""><em>‘Ruth's arrival in New York’</em></div></div><div class=""exg""><div class=""ex""><em>‘he was dead on arrival at hospital’</em></div></div><div class=""synonyms""><div class=""moreInfo""></div><div class=""exg""><div><strong class=""syn"">coming</strong><span class=""syn"">, advent, appearance, entrance, entry, materialization, approach</span></div></div></div><p><ul class=""subSenses""><li class=""subSense""><span class=""subsenseIteration"">1.1</span><u><span class=""grammatical_note"">count noun</span></u> <span class=""ind"">A person who has arrived somewhere.</span><div class=""trg""></div><div class=""exg""><div class=""ex""><em>‘hotel staff greeted the late arrivals’</em></div></div><div class=""synonyms""><div class=""moreInfo""></div><div class=""exg""><div><strong class=""syn"">comer</strong><span class=""syn"">, entrant, newcomer, new boy, new girl, incomer</span></div></div></div></li><li class=""subSense""><span class=""subsenseIteration"">1.2</span><span class=""ind"">The emergence or appearance of a new development or product.</span><div class=""trg""></div><div class=""exg""><div class=""ex""><em>‘the arrival of democracy’</em></div></div><div class=""synonyms""><div class=""moreInfo""></div><div class=""exg""><div><strong class=""syn"">emergence</strong><span class=""syn"">, appearance, first appearance, advent, coming, materialization, surfacing, occurrence, dawn, origin, birth, rise, springing up, development, start, onset, inauguration</span></div></div></div></li><li class=""subSense""><span class=""subsenseIteration"">1.3</span><u><span class=""grammatical_note"">count noun</span></u> <span class=""ind"">A newly emerged development or product.</span><div class=""trg""></div><div class=""exg""><div class=""ex""><em>‘sociology is a relatively new arrival on the academic scene’</em></div></div></li></ul></p></div></li></ul></section>"
aside,"<section class=""gramb""><h3 class=""ps pos""><span class=""pos"">adverb</span></h3><span class=""transitivity""></span><ul class=""semb""><li><div class=""trg""><p><span class=""iteration"">1</span><span class=""ind"">To one side; out of the way.</span></p><span class=""indicators""></span><div class=""exg""><div class=""ex""><em>‘he pushed his plate aside’</em></div></div><div class=""exg""><div class=""ex""><em>‘they stood aside to let a car pass’</em></div></div><div class=""exg""><div class=""ex""><em>‘she must put aside all her antagonistic feelings’</em></div></div><div class=""synonyms""><div class=""moreInfo""></div><div class=""exg""><div><strong class=""syn"">to one side</strong><span class=""syn"">, to the side</span></div></div></div><p><ul class=""subSenses""><li class=""subSense""><span class=""subsenseIteration"">1.1</span><span class=""ind"">In reserve; for future use.</span><div class=""trg""></div><div class=""exg""><div class=""ex""><em>‘she set aside some money for rent’</em></div></div></li><li class=""subSense""><span class=""subsenseIteration"">1.2</span><span class=""ind"">Used to indicate that one is dismissing a topic or changing to a new subject.</span><div class=""trg""></div><div class=""exg""><div class=""ex""><em>‘joking aside, I've certainly had my fill’</em></div></div><div class=""synonyms""><div class=""moreInfo""></div><div class=""exg""><div><strong class=""syn"">apart</strong><span class=""syn"">, notwithstanding</span></div></div></div></li></ul></p></div></li></ul></section><hr><section class=""gramb""><h3 class=""ps pos""><span class=""pos"">noun</span></h3><span class=""transitivity""></span><ul class=""semb""><li><div class=""trg""><p><span class=""iteration"">1</span><span class=""ind"">A remark or passage in a play that is intended to be heard by the audience but unheard by the other characters in the play.</span></p><span class=""indicators""></span><div class=""exg""><div class=""ex""><em>‘Shakespeare's use of asides and soliloquies’</em></div></div><div class=""synonyms""><div class=""moreInfo""></div><div class=""exg""><div><strong class=""syn"">whispered remark</strong><span class=""syn"">, confidential remark, stage whisper</span></div></div></div><p><ul class=""subSenses""><li class=""subSense""><span class=""subsenseIteration"">1.1</span><span class=""ind"">A remark not intended to be heard by everyone present.</span><div class=""trg""></div><div class=""exg""><div class=""ex""><em>‘‘Does that make him a murderer?’ whispered Alice in an aside to Fred’</em></div></div></li><li class=""subSense""><span class=""subsenseIteration"">1.2</span><span class=""ind"">A remark that is not directly related to the main topic of discussion.</span><div class=""trg""></div><div class=""exg""><div class=""ex""><em>‘the recipe book has little asides about the importance of home and family’</em></div></div></li></ul></p></div></li></ul></section>"
asleep,"<section class=""gramb""><h3 class=""ps pos""><span class=""pos"">adjective</span></h3><span class=""transitivity""></span><u><span class=""grammatical_note"">predicative</span></u> <ul class=""semb""><li><div class=""trg""><p><span class=""iteration"">1</span><span class=""ind"">In a state of sleep.</span></p><span class=""indicators""></span><div class=""exg""><div class=""ex""><em>‘she had been asleep for over three hours’</em></div></div><div class=""exg""><div class=""ex""><em>‘a man lay asleep’</em></div></div><div class=""exg""><div class=""ex""><em>‘he soon fell asleep’</em></div></div><div class=""synonyms""><div class=""moreInfo""></div><div class=""exg""><div><strong class=""syn"">sleeping</strong><span class=""syn"">, fast asleep, sound asleep, in a deep sleep, slumbering, napping, catnapping, dozing, resting, reposing, drowsing, dormant, comatose</span></div></div></div><p><ul class=""subSenses""><li class=""subSense""><span class=""subsenseIteration"">1.1</span><span class=""ind"">Not attentive or alert; inactive.</span><div class=""trg""></div><div class=""exg""><div class=""ex""><em>‘the competition was not asleep’</em></div></div><div class=""synonyms""><div class=""moreInfo""></div><div class=""exg""><div><strong class=""syn"">inactive</strong><span class=""syn"">, inert, latent, fallow, passive, idle, at rest, inoperative, deactivated, in abeyance, quiet</span></div></div></div></li><li class=""subSense""><span class=""subsenseIteration"">1.2</span><span class=""ind"">(of a limb) having no feeling; numb.</span><div class=""trg""></div><div class=""exg""><div class=""ex""><em>‘his legs were asleep’</em></div></div><div class=""synonyms""><div class=""moreInfo""></div><div class=""exg""><div><strong class=""syn"">numb</strong><span class=""syn"">, without feeling, numbed, benumbed, dead, deadened, desensitized, insensible, insensate, senseless, unfeeling</span></div></div></div></li><li class=""subSense""><span class=""subsenseIteration"">1.3</span><span class=""sense-registers"">literary </span><span class=""ind"">Used euphemistically to indicate that someone is dead.</span><div class=""trg""></div><div class=""exg""><div class=""ex""><em>‘The dead lie asleep, but in the second coming they shall be awakened from their graves and clothed in new skin.’</em></div></div><div class=""synonyms""><div class=""moreInfo""></div><div class=""exg""><div><strong class=""syn"">dead</strong><span class=""syn"">, expired, departed, gone, no more, passed on, passed away</span></div></div></div></li></ul></p></div></li></ul></section>"
assist,"<section class=""gramb""><h3 class=""ps pos""><span class=""pos"">verb</span></h3><span class=""transitivity""><span class=""neutral"">[</span>with object<span class=""neutral"">]</span></span><ul class=""semb""><li><div class=""trg""><p><span class=""iteration"">1</span><span class=""ind"">Help (someone), typically by doing a share of the work.</span></p><span class=""indicators""></span><div class=""exg""><div class=""ex""><em>‘a senior academic would assist him in his work’</em></div></div><div class=""exg""><div class=""ex""><u><span class=""grammatical_note"">no object</span></u> <em>‘their presence would assist in keeping the peace’</em></div></div><div class=""synonyms""><div class=""moreInfo""></div><div class=""exg""><div><strong class=""syn"">help</strong><span class=""syn"">, aid, abet, lend a hand to, lend a helping hand to, give assistance to, be of use to, oblige, accommodate, serve, be of service to, do someone a service, do someone a favour, do someone a good turn, bail someone out, come to someone's rescue</span></div></div></div><p><ul class=""subSenses""><li class=""subSense""><span class=""subsenseIteration"">1.1</span><span class=""ind"">Help by providing money or information.</span><div class=""trg""></div><div class=""exg""><div class=""ex""><em>‘they were assisting police with their inquiries’</em></div></div><div class=""exg""><div class=""ex""><u><span class=""grammatical_note"">no object</span></u> <em>‘funds to assist with capital investment’</em></div></div><div class=""synonyms""><div class=""moreInfo""></div><div class=""exg""><div><strong class=""syn"">facilitate</strong><span class=""syn"">, aid, ease, make easier, expedite, spur, promote, boost, give a boost to, benefit, foster, encourage, stimulate, precipitate, accelerate, advance, further, forward, help along, contribute to, be a factor in, smooth the way for, clear a path for, open the door for, oil the wheels of</span></div></div></div></li><li class=""subSense""><span class=""subsenseIteration"">1.2</span><u><span class=""grammatical_note"">no object</span></u> <span class=""ind"">Be present as a helper.</span><div class=""trg""></div><div class=""exg""><div class=""ex""><em>‘two midwives who assisted at a water birth’</em></div></div></li></ul></p></div></li></ul></section><hr><section class=""gramb""><h3 class=""ps pos""><span class=""pos"">noun</span></h3><span class=""transitivity""></span><ul class=""semb""><li><div class=""trg""><p><span class=""iteration"">1</span><span class=""sense-regions"">North American </span><span class=""ind"">An act of giving help, typically by providing money.</span></p><span class=""indicators""></span><div class=""exg""><div class=""ex""><em>‘the budget must have an assist from tax policies’</em></div></div><p><ul class=""subSenses""><li class=""subSense""><span class=""subsenseIteration"">1.1</span><span class=""ind"">(in sport) an act of touching the ball in a play in which a teammate scores or an opposing batter is put out.</span><div class=""trg""></div><div class=""exg""><div class=""ex""><em>‘Elliot had 10 points and five assists’</em></div></div></li></ul></p></div></li></ul></section>"
