keen,"<section class=""gramb""><h3 class=""ps pos""><span class=""pos"">adjective</span></h3><span class=""transitivity""></span><ul class=""semb""><li><div class=""trg""><p><span class=""iteration"">1</span><span class=""sense-regions"">British </span><span class=""ind"">Having or showing eagerness or enthusiasm.</span></p><span class=""indicators""></span><div class=""exg""><div class=""ex""><em>‘a keen gardener’</em></div></div><div class=""exg""><div class=""ex""><em>‘John was keen to help’</em></div></div><div class=""synonyms""><div class=""moreInfo""></div><div class=""exg""><div><strong class=""syn"">eager</strong><span class=""syn"">, anxious, impatient, determined, desirous, longing, wishing, itching, dying, yearning, ambitious, ready</span></div><div><strong class=""syn"">enthusiastic</strong><span class=""syn"">, avid, eager, ardent, passionate, fervent, fervid, impassioned, wholehearted, zestful, zealous, driven</span></div></div></div><p><ul class=""subSenses""><li class=""subSense""><span class=""subsenseIteration"">1.1</span><span class=""form-groups""><strong>keen on</strong></span><span class=""ind"">Interested in or attracted by (someone or something)</span><div class=""trg""></div><div class=""exg""><div class=""ex""><em>‘Bob makes it obvious he's keen on her’</em></div></div><div class=""synonyms""><div class=""moreInfo""></div><div class=""exg""><div><strong class=""syn"">enthusiastic about</strong><span class=""syn"">, interested in, passionate about, fascinated by</span></div></div></div></li></ul></p></div></li><li><div class=""trg""><p><span class=""iteration"">2</span><span class=""ind"">(of a sense) highly developed.</span></p><span class=""indicators""></span><div class=""exg""><div class=""ex""><em>‘I have keen eyesight’</em></div></div><div class=""synonyms""><div class=""moreInfo""></div><div class=""exg""><div><strong class=""syn"">acute</strong><span class=""syn"">, sharp, penetrating, discerning, sensitive, perceptive, piercing, clear, observant</span></div></div></div><p><ul class=""subSenses""><li class=""subSense""><span class=""subsenseIteration"">2.1</span><span class=""ind"">Having or showing great perception or insight.</span><div class=""trg""></div><div class=""exg""><div class=""ex""><em>‘her keen intellect’</em></div></div><div class=""exg""><div class=""ex""><em>‘a keen understanding of animal psychology’</em></div></div><div class=""synonyms""><div class=""moreInfo""></div><div class=""exg""><div><strong class=""syn"">acute</strong><span class=""syn"">, penetrating, astute, incisive, sharp, perceptive, piercing, rapier-like, razor-like, razor-sharp, perspicacious, shrewd, subtle, finely honed, quick-witted, sharp-witted, discerning, clever, intelligent, brilliant, bright, smart, wise, canny, percipient, insightful, sagacious, sapient</span></div></div></div></li></ul></p></div></li><li><div class=""trg""><p><span class=""iteration"">3</span><span class=""ind"">(of the edge or point of a blade) sharp.</span></p><span class=""indicators""></span><div class=""exg""><div class=""ex""><em>‘the keen blade went through the weeds’</em></div></div><div class=""synonyms""><div class=""moreInfo""></div><div class=""exg""><div><strong class=""syn"">sharp</strong><span class=""syn"">, sharp-edged, sharpened, honed, razor-like, razor-sharp, whetted, fine-edged</span></div></div></div><p><ul class=""subSenses""><li class=""subSense""><span class=""subsenseIteration"">3.1</span><span class=""ind"">(of the air or wind) extremely cold; biting.</span><div class=""trg""></div><div class=""exg""><div class=""ex""><em>‘a keen wind cut through their thick overalls’</em></div></div><div class=""synonyms""><div class=""moreInfo""></div><div class=""exg""><div><strong class=""syn"">cold</strong><span class=""syn"">, icy, freezing, harsh, raw, bitter</span></div></div></div></li><li class=""subSense""><span class=""subsenseIteration"">3.2</span><span class=""sense-registers"">literary </span><span class=""ind"">(of a smell, light, or sound) penetrating; clear.</span><div class=""trg""></div><div class=""exg""><div class=""ex""><em>‘ear-splitting explosive bursts, keen and sharp’</em></div></div></li></ul></p></div></li><li><div class=""trg""><p><span class=""iteration"">4</span><span class=""sense-regions"">British </span><span class=""ind"">(of activity or feeling) intense.</span></p><span class=""indicators""></span><div class=""exg""><div class=""ex""><em>‘there could be keen competition to provide the service’</em></div></div><div class=""synonyms""><div class=""moreInfo""></div><div class=""exg""><div><strong class=""syn"">intense</strong><span class=""syn"">, acute, extreme, fierce, violent, passionate, consuming, burning, fervent, fervid, ardent</span></div></div></div><p><ul class=""subSenses""><li class=""subSense""><span class=""subsenseIteration"">4.1</span><span class=""ind"">(of prices) very low; competitive.</span><div class=""trg""></div><div class=""exg""><div class=""ex""><em>‘we offer extremely keen rates’</em></div></div><div class=""synonyms""><div class=""moreInfo""></div><div class=""exg""><div><strong class=""syn"">reasonable</strong><span class=""syn"">, moderate, economical, keen</span></div></div></div></li></ul></p></div></li><li><div class=""trg""><p><span class=""iteration"">5</span><span class=""sense-regions"">North American </span><span class=""sense-registers"">informal, dated </span><u><span class=""grammatical_note"">predicative</span></u> <span class=""ind"">Excellent.</span></p><span class=""indicators""></span><div class=""exg""><div class=""ex""><em>‘I would soon fly to distant stars—how keen!’</em></div></div></div></li></ul></section><hr><section class=""gramb""><h3 class=""ps pos""><span class=""pos"">verb</span></h3><span class=""transitivity""><span class=""neutral"">[</span>no object<span class=""neutral"">]</span></span><ul class=""semb""><li><div class=""trg""><p><span class=""iteration"">1</span><span class=""ind"">Wail in grief for a dead person.</span></p><span class=""indicators""></span><div class=""exg""><div class=""ex""><em>‘the body of Johnny was taken by his own people who keened over him’</em></div></div><div class=""synonyms""><div class=""moreInfo""></div><div class=""exg""><div><strong class=""syn"">lament</strong><span class=""syn"">, mourn, weep, cry, sob, sorrow, grieve</span></div></div></div><p><ul class=""subSenses""><li class=""subSense""><span class=""subsenseIteration"">1.1</span><span class=""ind"">Make an eerie wailing sound.</span><div class=""trg""></div><div class=""exg""><div class=""ex""><em>‘the wind blew and wild birds keened in the sky’</em></div></div><div class=""synonyms""><div class=""moreInfo""></div><div class=""exg""><div><strong class=""syn"">lament</strong><span class=""syn"">, mourn, weep, cry, sob, sorrow, grieve</span></div></div></div></li></ul></p></div></li></ul></section><hr><section class=""gramb""><h3 class=""ps pos""><span class=""pos"">noun</span></h3><span class=""transitivity""></span><ul class=""semb""><li><div class=""trg""><p><span class=""iteration""></span><span class=""ind"">An Irish funeral song accompanied by wailing in lamentation for the dead.</span></p><span class=""indicators""></span></div></li></ul></section>"
lean,"<section class=""gramb""><h3 class=""ps pos""><span class=""pos"">verb</span><span class=""pos-inflections""><span class=""inflection-text""><span>leaned, </span></span><span class=""inflection-text""><em class=""languageGroup"">British </em><span>leant</span></span></span></h3><span class=""transitivity""></span><u><span class=""grammatical_note"">no object, with adverbial</span></u> <ul class=""semb""><li><div class=""trg""><p><span class=""iteration"">1</span><span class=""ind"">Be in or move into a sloping position.</span></p><span class=""indicators""></span><div class=""exg""><div class=""ex""><em>‘he leaned back in his chair’</em></div></div><div class=""synonyms""><div class=""moreInfo""></div><div class=""exg""><div><strong class=""syn"">slant</strong><span class=""syn"">, incline, bend, tilt, be at an angle, slope, tip, bank, list, heel, careen, cant, bias, veer, sway, angle</span></div></div></div><p><ul class=""subSenses""><li class=""subSense""><span class=""subsenseIteration"">1.1</span><span class=""form-groups""><strong>lean against/on</strong></span><span class=""ind"">Incline from the perpendicular and rest for support against (something)</span><div class=""trg""></div><div class=""exg""><div class=""ex""><em>‘a man was leaning against the wall’</em></div></div><div class=""synonyms""><div class=""moreInfo""></div><div class=""exg""><div><strong class=""syn"">rest</strong><span class=""syn"">, be propped up, recline, be supported</span></div></div></div></li><li class=""subSense""><span class=""subsenseIteration"">1.2</span><span class=""form-groups""><strong>lean something against/on</strong></span><u><span class=""grammatical_note"">with object</span></u> <span class=""ind"">Cause something to rest against.</span><div class=""trg""></div><div class=""exg""><div class=""ex""><em>‘he leaned his elbows on the table’</em></div></div><div class=""synonyms""><div class=""moreInfo""></div><div class=""exg""><div><strong class=""syn"">rest</strong><span class=""syn"">, be propped up, recline, be supported</span></div></div></div></li></ul></p></div></li></ul></section><hr><section class=""gramb""><h3 class=""ps pos""><span class=""pos"">noun</span></h3><span class=""transitivity""></span><ul class=""semb""><li><div class=""trg""><p><span class=""iteration""></span><span class=""ind"">A deviation from the perpendicular; an inclination.</span></p><span class=""indicators""></span><div class=""exg""><div class=""ex""><em>‘the vehicle has a definite lean to the left’</em></div></div></div></li></ul></section><hr><section class=""gramb""><h3 class=""ps pos""><span class=""pos"">adjective</span></h3><span class=""transitivity""></span><ul class=""semb""><li><div class=""trg""><p><span class=""iteration"">1</span><span class=""ind"">(of a person or animal) thin, especially healthily so; having no superfluous fat.</span></p><span class=""indicators""></span><div class=""exg""><div class=""ex""><em>‘his lean, muscular body’</em></div></div><div class=""synonyms""><div class=""moreInfo""></div><div class=""exg""><div><strong class=""syn"">slim</strong><span class=""syn"">, thin, slender, rangy, spare, wiry, slight</span></div></div></div><p><ul class=""subSenses""><li class=""subSense""><span class=""subsenseIteration"">1.1</span><span class=""ind"">(of meat) containing little fat.</span><div class=""trg""></div><div class=""exg""><div class=""ex""><em>‘lean bacon’</em></div></div><div class=""synonyms""><div class=""moreInfo""></div><div class=""exg""><div><strong class=""syn"">non-fatty</strong><span class=""syn"">, unfatty</span></div></div></div></li><li class=""subSense""><span class=""subsenseIteration"">1.2</span><span class=""ind"">(of an industry or company) efficient and with no wastage.</span><div class=""trg""></div><div class=""exg""><div class=""ex""><em>‘staff were pruned, ostensibly to produce a leaner and fitter organization’</em></div></div></li></ul></p></div></li><li><div class=""trg""><p><span class=""iteration"">2</span><span class=""ind"">Offering little reward, substance, or nourishment; meagre.</span></p><span class=""indicators""></span><div class=""exg""><div class=""ex""><em>‘the lean winter months’</em></div></div><div class=""exg""><div class=""ex""><em>‘keep a small reserve to tide you over the lean years’</em></div></div><div class=""synonyms""><div class=""moreInfo""></div><div class=""exg""><div><strong class=""syn"">meagre</strong><span class=""syn"">, scanty, sparse, poor, scant, mean, inadequate, insufficient, paltry, limited, restricted, modest, deficient, insubstantial, slight</span></div><div><strong class=""syn"">unproductive</strong><span class=""syn"">, unfruitful, unprofitable, unremunerative, arid, barren</span></div></div></div></div></li><li><div class=""trg""><p><span class=""iteration"">3</span><span class=""ind"">(of a vaporized fuel mixture) having a high proportion of air.</span></p><span class=""indicators""></span><div class=""exg""><div class=""ex""><em>‘lean air-to-fuel ratios’</em></div></div></div></li></ul></section><hr><section class=""gramb""><h3 class=""ps pos""><span class=""pos"">noun</span></h3><u><span class=""grammatical_note countability"">mass noun</span></u><span class=""transitivity""></span><ul class=""semb""><li><div class=""trg""><p><span class=""iteration""></span><span class=""ind"">The lean part of meat.</span></p><span class=""indicators""></span><div class=""exg""><div class=""ex""><em>‘the man who eats no fat and the wife who eats no lean’</em></div></div></div></li></ul></section>"
license,"<section class=""gramb""><h3 class=""ps pos""><span class=""pos"">verb</span></h3><span class=""transitivity""><span class=""neutral"">[</span>with object<span class=""neutral"">]</span></span><ul class=""semb""><li><div class=""trg""><p><span class=""iteration"">1</span><span class=""ind"">Grant a licence to.</span></p><span class=""indicators""></span><div class=""exg""><div class=""ex""><em>‘a pub has to be licensed by the local justices’</em></div></div><div class=""exg""><div class=""ex""><u><span class=""grammatical_note"">with object and infinitive</span></u> <em>‘he ought not to have been licensed to fly a plane’</em></div></div><p><ul class=""subSenses""><li class=""subSense""><span class=""subsenseIteration"">1.1</span><span class=""ind"">Authorize the use, performance, or release of (something)</span><div class=""trg""></div><div class=""exg""><div class=""ex""><em>‘the company expect that the drug will soon be licensed for use in the USA’</em></div></div></li><li class=""subSense""><span class=""subsenseIteration"">1.2</span><span class=""sense-registers"">dated </span><span class=""ind"">Permit (someone) to do something.</span><div class=""trg""></div><div class=""exg""><div class=""ex""><u><span class=""grammatical_note"">with object and infinitive</span></u> <em>‘he was licensed to do no more than send a message’</em></div></div></li></ul></p></div></li></ul></section>"
loaf,"<section class=""gramb""><h3 class=""ps pos""><span class=""pos"">noun</span><span class=""pos-inflections""><span class=""inflection-text""><span>loaves</span></span></span></h3><span class=""transitivity""></span><ul class=""semb""><li><div class=""trg""><p><span class=""iteration"">1</span><span class=""ind"">A quantity of bread that is shaped and baked in one piece and usually sliced before being eaten.</span></p><span class=""indicators""></span><div class=""exg""><div class=""ex""><em>‘a loaf of bread’</em></div></div><div class=""exg""><div class=""ex""><em>‘a granary loaf’</em></div></div><p><ul class=""subSenses""><li class=""subSense""><span class=""subsenseIteration"">1.1</span><span class=""ind"">An item of food formed into an oblong shape and sliced into portions.</span><div class=""trg""></div></li></ul></p></div></li></ul></section><hr><section class=""gramb""><h3 class=""ps pos""><span class=""pos"">verb</span></h3><span class=""transitivity""><span class=""neutral"">[</span>no object<span class=""neutral"">]</span></span><ul class=""semb""><li><div class=""trg""><p><span class=""iteration""></span><span class=""ind"">Spend one's time in an aimless, idle way.</span></p><span class=""indicators""></span><div class=""exg""><div class=""ex""><em>‘don't let him see you loafing about with your hands in your pockets’</em></div></div><div class=""synonyms""><div class=""moreInfo""></div><div class=""exg""><div><strong class=""syn"">laze</strong><span class=""syn"">, lounge, loll</span></div></div></div></div></li></ul></section>"
minor,"<section class=""gramb""><h3 class=""ps pos""><span class=""pos"">adjective</span></h3><span class=""transitivity""></span><ul class=""semb""><li><div class=""trg""><p><span class=""iteration"">1</span><span class=""ind"">Lesser in importance, seriousness, or significance.</span></p><span class=""indicators""></span><div class=""exg""><div class=""ex""><em>‘she requested a number of minor alterations’</em></div></div><div class=""synonyms""><div class=""moreInfo""></div><div class=""exg""><div><strong class=""syn"">slight</strong><span class=""syn"">, small</span></div><div><strong class=""syn"">little known</strong><span class=""syn"">, unknown, lesser</span></div></div></div></div></li><li><div class=""trg""><p><span class=""iteration"">2</span><span class=""sense-regions domain_labels"">Music </span><br/><span class=""ind"">(of a scale) having intervals of a semitone between the second and third degrees, and (usually) the fifth and sixth, and the seventh and eighth.</span></p><span class=""indicators""></span><div class=""exg""><div class=""ex""><em>‘Yet by bar 3, where the two basic scale-motifs are concatenated to form five notes of an A minor scale, the tonality is in doubt.’</em></div></div><div class=""crossReference"">Contrasted with <a>major</a></div><div class=""exg""><div class=""ex""><em>‘The fingering chart provided on page 111 fails to identify the minor scale form being illustrated.’</em></div></div><p><ul class=""subSenses""><li class=""subSense""><span class=""subsenseIteration"">2.1</span><span class=""ind"">(of an interval) characteristic of a minor scale and less by a semitone than the equivalent major interval.</span><div class=""trg""><div class=""crossReference"">Compare with <a>diminished</a></div></div><div class=""exg""><div class=""ex""><em>‘the E flat clarinet sounds a minor third higher than the written notes’</em></div></div><div class=""crossReference"">Compare with <a>diminished</a></div></li><li class=""subSense""><span class=""subsenseIteration"">2.2</span><u><span class=""grammatical_note"">usually postpositive</span></u> <span class=""ind"">(of a key or mode) based on a minor scale and tending to produce a sad or pensive effect.</span><div class=""trg""></div><div class=""exg""><div class=""ex""><em>‘Concerto in A minor’</em></div></div></li></ul></p></div></li><li><div class=""trg""><p><span class=""iteration"">3</span><span class=""sense-regions"">British </span><span class=""sense-registers"">dated </span><span class=""ind"">(following a surname in public schools) indicating the younger of two brothers.</span></p><span class=""indicators""></span><div class=""exg""><div class=""ex""><em>‘Smith minor’</em></div></div><div class=""synonyms""><div class=""moreInfo""></div><div class=""exg""><div><strong class=""syn"">junior</strong><span class=""syn"">, younger</span></div></div></div></div></li><li><div class=""trg""><p><span class=""iteration"">4</span><span class=""sense-regions domain_labels"">Logic </span><br/><span class=""ind"">(of a term) occurring as the subject of the conclusion of a categorical syllogism.</span></p><span class=""indicators""></span><div class=""exg""><div class=""ex""><em>‘where P, S, and M are the major, minor, and middle terms of the syllogism.’</em></div></div><p><ul class=""subSenses""><li class=""subSense""><span class=""subsenseIteration"">4.1</span><span class=""ind"">(of a premise) containing the minor term in a categorical syllogism.</span><div class=""trg""></div></li></ul></p></div></li></ul></section><hr><section class=""gramb""><h3 class=""ps pos""><span class=""pos"">noun</span></h3><span class=""transitivity""></span><ul class=""semb""><li><div class=""trg""><p><span class=""iteration"">1</span><span class=""ind"">A person under the age of full legal responsibility.</span></p><span class=""indicators""></span><div class=""exg""><div class=""ex""><em>‘the court would take account of the minor's wishes’</em></div></div><div class=""synonyms""><div class=""moreInfo""></div><div class=""exg""><div><strong class=""syn"">child</strong><span class=""syn"">, infant, youth</span></div></div></div></div></li><li><div class=""trg""><p><span class=""iteration"">2</span><span class=""sense-regions domain_labels"">Music </span><br/><span class=""ind"">A minor key, interval, or scale.</span></p><span class=""indicators""></span><p><ul class=""subSenses""><li class=""subSense""><span class=""subsenseIteration"">2.1</span><span class=""sense-regions domain_labels"">Bell Ringing </span><span class=""ind"">A system of change-ringing using six bells.</span><div class=""trg""></div><div class=""exg""><div class=""ex""><em>‘Other terms for even numbers of bells include Minor (6 bells), Major (8 bells), Royal (10 bells) and Maximus (12 bells).’</em></div></div><div class=""exg""><div class=""ex""><em>‘We ring whatever people ask for including Stedman Doubles, Crayford Minor and Norwich Surprise Minor.’</em></div></div></li></ul></p></div></li><li><div class=""trg""><p><span class=""iteration"">3</span><span class=""form-groups""><strong>minors</strong></span><span class=""sense-regions"">North American </span><span class=""ind"">The minor leagues in baseball or American football.</span></p><span class=""indicators""></span><div class=""exg""><div class=""ex""><em>‘Salinas was one of six teams in the minors’</em></div></div></div></li><li><div class=""trg""><p><span class=""iteration"">4</span><span class=""sense-regions"">North American </span><span class=""ind"">A student's subsidiary subject or course.</span></p><span class=""indicators""></span><div class=""exg""><div class=""ex""><em>‘a minor in American Indian studies’</em></div></div></div></li><li><div class=""trg""><p><span class=""iteration"">5</span><span class=""sense-regions domain_labels"">Logic </span><br/><span class=""ind"">A minor term or premise.</span></p><span class=""indicators""></span><div class=""exg""><div class=""ex""><em>‘I prove the minor, because your father is known by you and your father is the one approaching; hence, the one approaching is known by you.’</em></div></div><div class=""exg""><div class=""ex""><em>‘This is called the fallacy of the illicit minor.’</em></div></div></div></li><li><div class=""trg""><p><span class=""iteration"">6</span><span class=""sense-regions domain_labels"">Bridge </span><br/><div class=""crossReference"">short for <a>minor suit</a></div></p><span class=""indicators""></span><div class=""exg""><div class=""ex""><em>‘a bid of two no trumps shows strength in the minors’</em></div></div><div class=""crossReference"">short for <a>minor suit</a></div></div></li><li><div class=""trg""><p><span class=""iteration"">7</span><span class=""ind"">A small drab moth which has purplish caterpillars that feed on grass.</span></p><p class=""note"">Genus Oligia, family Noctuidae</p><span class=""indicators""></span><div class=""exg""><div class=""ex""><em>‘Minors and Rustics are extremely small and are often mistaken for micro moths, especially Pyralids.’</em></div></div><div class=""exg""><div class=""ex""><em>‘Some Minors also fly in sunshine.’</em></div></div></div></li></ul></section><hr><section class=""gramb""><h3 class=""ps pos""><span class=""pos"">verb</span></h3><span class=""transitivity""><span class=""neutral"">[</span>no object<span class=""neutral"">]</span></span><span class=""sense-regions spanish_label"">North American </span><span class=""form-groups""><strong>minor in</strong></span> <ul class=""semb""><li><div class=""trg""><p><span class=""iteration""></span><span class=""ind"">Study as or qualify in a subsidiary subject at college or university.</span></p><span class=""indicators""></span><div class=""exg""><div class=""ex""><em>‘Clark had minored in Animal Science’</em></div></div></div></li></ul></section>"
