bake,"<section class=""gramb""><h3 class=""ps pos""><span class=""pos"">verb</span></h3><span class=""transitivity""><span class=""neutral"">[</span>with object<span class=""neutral"">]</span></span><ul class=""semb""><li><div class=""trg""><p><span class=""iteration"">1</span><span class=""ind"">Cook (food) by dry heat without direct exposure to a flame, typically in an oven.</span></p><span class=""indicators""></span><div class=""exg""><div class=""ex""><em>‘they bake their own bread and cakes’</em></div></div><div class=""synonyms""><div class=""moreInfo""></div><div class=""exg""><div><strong class=""syn"">cook</strong><span class=""syn"">, oven-bake, dry-roast, roast, spit-roast, pot-roast</span></div></div></div><p><ul class=""subSenses""><li class=""subSense""><span class=""subsenseIteration"">1.1</span><u><span class=""grammatical_note"">no object</span></u> <span class=""ind"">(of food) be cooked by baking.</span><div class=""trg""></div><div class=""exg""><div class=""ex""><em>‘the bread was baking on hot stones’</em></div></div><div class=""synonyms""><div class=""moreInfo""></div><div class=""exg""><div><strong class=""syn"">brown</strong><span class=""syn"">, crisp, crisp up, grill, barbecue, bake, singe, sear</span></div></div></div></li></ul></p></div></li><li><div class=""trg""><p><span class=""iteration"">2</span><span class=""ind"">(of the sun or other agency) subject (something) to dry heat, especially so as to harden it.</span></p><span class=""indicators""></span><div class=""exg""><div class=""ex""><em>‘the soil in the desert is baked dry by the fierce heat of the sun’</em></div></div><div class=""synonyms""><div class=""moreInfo""></div><div class=""exg""><div><strong class=""syn"">scorch</strong><span class=""syn"">, burn, sear, parch, dry, dry up, desiccate, wither, shrivel, fire</span></div></div></div><p><ul class=""subSenses""><li class=""subSense""><span class=""subsenseIteration"">2.1</span><span class=""sense-registers"">informal </span><u><span class=""grammatical_note"">no object</span></u> <span class=""ind"">Be or become extremely hot in prolonged sun or hot weather.</span><div class=""trg""></div><div class=""exg""><div class=""ex""><em>‘the city was baking in a heatwave’</em></div></div><div class=""synonyms""><div class=""moreInfo""></div><div class=""exg""><div><strong class=""syn"">hot</strong><span class=""syn"">, stifling, suffocating, humid, steamy, sultry, sticky, muggy, close, stuffy, airless, oppressive, tropical, torrid, burning, searing, parching, like an oven, like a Turkish bath, jungle-like</span></div></div></div></li></ul></p></div></li></ul></section><hr><section class=""gramb""><h3 class=""ps pos""><span class=""pos"">noun</span></h3><span class=""transitivity""></span><u><span class=""grammatical_note"">with modifier</span></u> <ul class=""semb""><li><div class=""trg""><p><span class=""iteration"">1</span><span class=""sense-regions"">British </span><span class=""ind"">A dish consisting of a mixture of ingredients cooked in an oven.</span></p><span class=""indicators""></span><div class=""exg""><div class=""ex""><em>‘a vegetable bake’</em></div></div><p><ul class=""subSenses""><li class=""subSense""><span class=""subsenseIteration"">1.1</span><span class=""sense-regions spanish_label"">North American </span><u><span class=""grammatical_note"">with modifier</span></u> <span class=""ind"">A social gathering at which baked food of a specified kind is eaten.</span><div class=""trg""></div><div class=""exg""><div class=""ex""><em>‘lobster bakes’</em></div></div><div class=""synonyms""><div class=""moreInfo""></div><div class=""exg""><div><strong class=""syn"">social gathering</strong><span class=""syn"">, gathering, social occasion, social event, social function, function, get-together, celebration, reunion, festivity, jamboree, reception, at-home, soirée, social</span></div></div></div></li></ul></p></div></li></ul></section><hr><section class=""gramb""><h3 class=""ps pos""><span class=""pos"">noun</span></h3><span class=""transitivity""></span><ul class=""semb""><li><div class=""trg""><p><span class=""iteration"">1</span><span class=""sense-regions"">Northern Irish </span><span class=""sense-registers"">informal </span><span class=""ind"">A person's mouth.</span></p><span class=""indicators""></span><div class=""exg""><div class=""ex""><em>‘shut your bake!’</em></div></div><p><ul class=""subSenses""><li class=""subSense""><span class=""subsenseIteration"">1.1</span><span class=""ind"">A person's face.</span><div class=""trg""></div><div class=""exg""><div class=""ex""><em>‘my oul bake is in every major newspaper’</em></div></div></li></ul></p></div></li></ul></section>"
bank,"<section class=""gramb""><h3 class=""ps pos""><span class=""pos"">noun</span></h3><span class=""transitivity""></span><ul class=""semb""><li><div class=""trg""><p><span class=""iteration"">1</span><span class=""ind"">The land alongside or sloping down to a river or lake.</span></p><span class=""indicators""></span><div class=""exg""><div class=""ex""><em>‘willows lined the bank of the stream’</em></div></div><div class=""synonyms""><div class=""moreInfo""></div><div class=""exg""><div><strong class=""syn"">edge</strong><span class=""syn"">, side, embankment, levee, border, verge, boundary, margin, rim, fringe, fringes, flank, brink, perimeter, circumference, extremity, periphery, limit, outer limit, limits, bound, bounds</span></div></div></div></div></li><li><div class=""trg""><p><span class=""iteration"">2</span><span class=""ind"">A long, high mass or mound of a particular substance.</span></p><span class=""indicators""></span><div class=""exg""><div class=""ex""><em>‘a grassy bank’</em></div></div><div class=""exg""><div class=""ex""><em>‘a bank of snow’</em></div></div><div class=""synonyms""><div class=""moreInfo""></div><div class=""exg""><div><strong class=""syn"">slope</strong><span class=""syn"">, rise, incline, gradient, ramp, acclivity, tump</span></div></div></div><p><ul class=""subSenses""><li class=""subSense""><span class=""subsenseIteration"">2.1</span><span class=""ind"">An elevation in the seabed or a riverbed; a mudbank or sandbank.</span><div class=""trg""></div></li><li class=""subSense""><span class=""subsenseIteration"">2.2</span><span class=""ind"">A transverse slope given to a road, railway, or sports track to enable vehicles or runners to maintain speed round a curve.</span><div class=""trg""></div><div class=""synonyms""><div class=""moreInfo""></div><div class=""exg""><div><strong class=""syn"">slope</strong><span class=""syn"">, rise, incline, gradient, ramp, acclivity, tump</span></div></div></div></li><li class=""subSense""><span class=""subsenseIteration"">2.3</span><u><span class=""grammatical_note"">mass noun</span></u> <span class=""ind"">The sideways tilt of an aircraft when turning in flight.</span><div class=""trg""></div><div class=""exg""><div class=""ex""><em>‘a rather steep angle of bank’</em></div></div></li></ul></p></div></li><li><div class=""trg""><p><span class=""iteration"">3</span><span class=""ind"">A set of similar things, especially electrical or electronic devices, grouped together in rows.</span></p><span class=""indicators""></span><div class=""exg""><div class=""ex""><em>‘the DJ had big banks of lights and speakers on either side of his console’</em></div></div><div class=""synonyms""><div class=""moreInfo""></div><div class=""exg""><div><strong class=""syn"">array</strong><span class=""syn"">, row, line, tier, group, series</span></div></div></div><p><ul class=""subSenses""><li class=""subSense""><span class=""subsenseIteration"">3.1</span><span class=""ind"">A tier of oars.</span><div class=""trg""></div><div class=""exg""><div class=""ex""><em>‘the early ships had only twenty-five oars in each bank’</em></div></div></li></ul></p></div></li><li><div class=""trg""><p><span class=""iteration"">4</span><span class=""ind"">The cushion of a pool table.</span></p><span class=""indicators""></span><div class=""exg""><div class=""ex""><u><span class=""grammatical_note"">as modifier</span></u> <em>‘a bank shot’</em></div></div></div></li></ul></section><hr><section class=""gramb""><h3 class=""ps pos""><span class=""pos"">verb</span></h3><span class=""transitivity""><span class=""neutral"">[</span>with object<span class=""neutral"">]</span></span><ul class=""semb""><li><div class=""trg""><p><span class=""iteration"">1</span><span class=""ind"">Heap (a substance) into a mass or mound.</span></p><span class=""indicators""></span><div class=""exg""><div class=""ex""><em>‘the rain banked the soil up behind the gate’</em></div></div><div class=""exg""><div class=""ex""><em>‘snow was banked in humps at the roadside’</em></div></div><div class=""synonyms""><div class=""moreInfo""></div><div class=""exg""><div><strong class=""syn"">pile</strong><span class=""syn"">, pile up, heap, heap up, stack, stack up, make a pile of, make a heap of, make a stack of</span></div></div></div><p><ul class=""subSenses""><li class=""subSense""><span class=""subsenseIteration"">1.1</span><u><span class=""grammatical_note"">no object</span></u> <span class=""ind"">Form into a mass or mound.</span><div class=""trg""></div><div class=""exg""><div class=""ex""><em>‘purple clouds banked up over the hills’</em></div></div></li><li class=""subSense""><span class=""subsenseIteration"">1.2</span><span class=""ind"">Heap up (a fire) with tightly packed fuel so that it burns slowly.</span><div class=""trg""></div><div class=""exg""><div class=""ex""><em>‘she banked up the fire’</em></div></div><div class=""synonyms""><div class=""moreInfo""></div><div class=""exg""><div><strong class=""syn"">damp</strong><span class=""syn"">, damp down, smother, stifle</span></div></div></div></li><li class=""subSense""><span class=""subsenseIteration"">1.3</span><span class=""ind"">Edge or surround with a ridge or row of something.</span><div class=""trg""></div><div class=""exg""><div class=""ex""><em>‘steps banked with pots of chrysanthemums’</em></div></div></li></ul></p></div></li><li><div class=""trg""><p><span class=""iteration"">2</span><span class=""ind"">(with reference to an aircraft or vehicle) tilt or cause to tilt sideways in making a turn.</span></p><span class=""indicators""></span><div class=""exg""><div class=""ex""><u><span class=""grammatical_note"">no object</span></u> <em>‘the plane banked as if to return to the airport’</em></div></div><div class=""exg""><div class=""ex""><u><span class=""grammatical_note"">with object</span></u> <em>‘I banked the aircraft steeply and turned’</em></div></div><div class=""synonyms""><div class=""moreInfo""></div><div class=""exg""><div><strong class=""syn"">tilt</strong><span class=""syn"">, lean, tip, slant, incline, angle, slope, list, camber, pitch, dip, cant, be at an angle, put at an angle</span></div></div></div><p><ul class=""subSenses""><li class=""subSense""><span class=""subsenseIteration"">2.1</span><u><span class=""grammatical_note"">with object</span></u> <span class=""ind"">Build (a road, railway, or sports track) higher at the outer edge of a bend to facilitate fast cornering.</span><div class=""trg""></div><div class=""exg""><div class=""ex""><em>‘the track was banked to allow a train to take curves faster while maintaining passenger comfort’</em></div></div><div class=""exg""><div class=""ex""><u><span class=""grammatical_note"">as adjective <strong>banked</strong></span></u> <em>‘a banked racetrack’</em></div></div></li></ul></p></div></li><li><div class=""trg""><p><span class=""iteration"">3</span><span class=""sense-regions"">British </span><span class=""ind"">(of a locomotive) provide additional power for (a train) in ascending an incline.</span></p><span class=""indicators""></span><div class=""exg""><div class=""ex""><em>‘he has built a four-cylinder locomotive for banking trains up the Lickey incline’</em></div></div></div></li><li><div class=""trg""><p><span class=""iteration"">4</span><span class=""ind"">(of an angler) succeed in landing (a fish)</span></p><span class=""indicators""></span><div class=""exg""><div class=""ex""><em>‘it was the biggest rainbow trout that had ever been banked’</em></div></div></div></li><li><div class=""trg""><p><span class=""iteration"">5</span><span class=""sense-regions"">North American </span><span class=""ind"">(in pool) play (a ball) so that it rebounds off a surface such as a cushion.</span></p><span class=""indicators""></span><div class=""exg""><div class=""ex""><em>‘I banked the eight ball off two cushions’</em></div></div></div></li></ul></section><hr><section class=""gramb""><h3 class=""ps pos""><span class=""pos"">noun</span></h3><span class=""transitivity""></span><ul class=""semb""><li><div class=""trg""><p><span class=""iteration"">1</span><span class=""ind"">A financial establishment that uses money deposited by customers for investment, pays it out when required, makes loans at interest, and exchanges currency.</span></p><span class=""indicators""></span><div class=""exg""><div class=""ex""><u><span class=""grammatical_note"">as modifier</span></u> <em>‘a bank account’</em></div></div><div class=""synonyms""><div class=""moreInfo""></div><div class=""exg""><div><strong class=""syn"">financial institution</strong></div></div></div><p><ul class=""subSenses""><li class=""subSense""><span class=""subsenseIteration"">1.1</span><span class=""ind"">A stock of something available for use when required.</span><div class=""trg""></div><div class=""exg""><div class=""ex""><em>‘a blood bank’</em></div></div><div class=""exg""><div class=""ex""><em>‘Britain has a bank of highly exportable skills’</em></div></div><div class=""synonyms""><div class=""moreInfo""></div><div class=""exg""><div><strong class=""syn"">store</strong><span class=""syn"">, reserve, accumulation, stock, stockpile, inventory, supply, pool, fund, cache, hoard, deposit</span></div></div></div></li><li class=""subSense""><span class=""subsenseIteration"">1.2</span><span class=""ind"">A site or receptacle where something may be deposited for recycling.</span><div class=""trg""></div><div class=""exg""><div class=""ex""><em>‘a paper bank’</em></div></div></li><li class=""subSense""><span class=""subsenseIteration"">1.3</span><span class=""form-groups""><strong>the bank</strong></span><span class=""ind"">The store of money or tokens held by the banker in some gambling or board games.</span><div class=""trg""></div><div class=""exg""><div class=""ex""><em>‘If everyone has played and there is money in the bank, the banker deals a new hand in the opposite direction from the hand that has just ended.’</em></div></div><div class=""exg""><div class=""ex""><em>‘The bank can also change hands after any hand if the existing banker wishes to sell the bank to another player at a mutually agreed price.’</em></div></div></li><li class=""subSense""><span class=""subsenseIteration"">1.4</span><span class=""ind"">The person holding the bank in some gambling or board games; the banker.</span><div class=""trg""></div></li><li class=""subSense""><span class=""subsenseIteration"">1.5</span><span class=""sense-regions spanish_label"">US </span><span class=""sense-registers"">informal </span><u><span class=""grammatical_note"">mass noun</span></u> <span class=""ind"">A large amount of money.</span><div class=""trg""></div><div class=""exg""><div class=""ex""><em>‘those entrepreneurs are raking in some serious bank’</em></div></div><div class=""exg""><div class=""ex""><em>‘the estate makes bank off the sale of merchandise’</em></div></div></li></ul></p></div></li></ul></section><hr><section class=""gramb""><h3 class=""ps pos""><span class=""pos"">verb</span></h3><span class=""transitivity""></span><ul class=""semb""><li><div class=""trg""><p><span class=""iteration"">1</span><u><span class=""grammatical_note"">with object</span></u> <span class=""ind"">Deposit (money or valuables) in a bank.</span></p><span class=""indicators""></span><div class=""exg""><div class=""ex""><em>‘she may have banked a cheque in the wrong account’</em></div></div><div class=""synonyms""><div class=""moreInfo""></div><div class=""exg""><div><strong class=""syn"">deposit</strong><span class=""syn"">, pay in</span></div><div><strong class=""syn"">have an account at</strong><span class=""syn"">, deposit one's money with, use, be a customer of, deal with, do business with</span></div></div></div><p><ul class=""subSenses""><li class=""subSense""><span class=""subsenseIteration"">1.1</span><u><span class=""grammatical_note"">no object</span></u> <span class=""ind"">Have an account at a particular bank.</span><div class=""trg""></div><div class=""exg""><div class=""ex""><em>‘the family has banked with Coutts for generations’</em></div></div></li><li class=""subSense""><span class=""subsenseIteration"">1.2</span><span class=""sense-registers"">informal </span><span class=""ind"">Win or earn (a sum of money)</span><div class=""trg""></div><div class=""exg""><div class=""ex""><em>‘he banked £100,000 for a hole-in-one’</em></div></div></li><li class=""subSense""><span class=""subsenseIteration"">1.3</span><span class=""ind"">Store (something, especially blood, tissue, or sperm) for future use.</span><div class=""trg""></div><div class=""exg""><div class=""ex""><em>‘the sperm is banked or held in storage for the following spring’</em></div></div></li></ul></p></div></li></ul></section>"
both,"<section class=""gramb""><h3 class=""ps pos""><span class=""pos"">predeterminer<span class=""listSeparator"">, </span>determiner<span class=""listSeparator"">,</span> <span class=""listSeparator"">&amp;</span> pronoun</span></h3><span class=""transitivity""></span><ul class=""semb""><li><div class=""trg""><p><span class=""iteration""></span><span class=""ind"">Used for emphasis to refer to two people or things, regarded and identified together.</span></p><span class=""indicators""></span><div class=""exg""><div class=""ex""><u><span class=""grammatical_note"">as predeterminer</span></u> <em>‘both his parents indulged him’</em></div></div><div class=""exg""><div class=""ex""><u><span class=""grammatical_note"">as determiner</span></u> <em>‘she held on with both hands’</em></div></div><div class=""exg""><div class=""ex""><em>‘cars parked on both sides of the road’</em></div></div><div class=""exg""><div class=""ex""><u><span class=""grammatical_note"">as pronoun</span></u> <em>‘a picture of both of us together’</em></div></div><div class=""exg""><div class=""ex""><em>‘he looked at them both’</em></div></div></div></li></ul></section><hr><section class=""gramb""><h3 class=""ps pos""><span class=""pos"">adverb</span></h3><span class=""transitivity""></span><ul class=""semb""><li><div class=""trg""><p><span class=""iteration""></span><span class=""ind"">Used before the first of two alternatives to emphasize that the statement being made applies to each (the other alternative being introduced by ‘and’)</span></p><span class=""indicators""></span><div class=""exg""><div class=""ex""><em>‘the film has won favour with both young and old’</em></div></div><div class=""exg""><div class=""ex""><em>‘studies of zebra finches, both in the wild and in captivity’</em></div></div></div></li></ul></section>"
