align,"<section class=""gramb""><h3 class=""ps pos""><span class=""pos"">verb</span></h3><span class=""transitivity""></span><ul class=""semb""><li><div class=""trg""><p><span class=""iteration"">1</span><u><span class=""grammatical_note"">with object</span></u> <span class=""ind"">Place or arrange (things) in a straight line.</span></p><span class=""indicators""></span><div class=""exg""><div class=""ex""><em>‘the desks are aligned in straight rows facing forwards’</em></div></div><div class=""synonyms""><div class=""moreInfo""></div><div class=""exg""><div><strong class=""syn"">line up</strong><span class=""syn"">, range, arrange in line, put in order, put in columns, put in rows, straighten, straighten up</span></div></div></div><p><ul class=""subSenses""><li class=""subSense""><span class=""subsenseIteration"">1.1</span><span class=""ind"">Put (things) into correct or appropriate relative positions.</span><div class=""trg""></div><div class=""exg""><div class=""ex""><em>‘the fan blades are carefully aligned’</em></div></div><div class=""exg""><div class=""ex""><em>‘aligning domestic prices with prices in world markets’</em></div></div><div class=""synonyms""><div class=""moreInfo""></div><div class=""exg""><div><strong class=""syn"">align</strong><span class=""syn"">, place, position, put, dispose, situate, set</span></div></div></div></li><li class=""subSense""><span class=""subsenseIteration"">1.2</span><u><span class=""grammatical_note"">no object</span></u> <span class=""ind"">Lie in a straight line, or in correct relative positions.</span><div class=""trg""></div><div class=""exg""><div class=""ex""><em>‘the pattern of the border at the joint should align perfectly’</em></div></div></li></ul></p></div></li><li><div class=""trg""><p><span class=""iteration"">2</span><span class=""form-groups""><strong>align oneself with</strong></span><span class=""ind"">Give support to (a person, organization, or cause)</span></p><span class=""indicators""></span><div class=""exg""><div class=""ex""><em>‘newspapers usually align themselves with certain political parties’</em></div></div><div class=""synonyms""><div class=""moreInfo""></div><div class=""exg""><div><strong class=""syn"">join forces with</strong><span class=""syn"">, join up with, form an alliance with, ally with, align oneself with, link up with, go into league with, combine with, join fortunes with, make common cause with</span></div></div></div><p><ul class=""subSenses""><li class=""subSense""><span class=""subsenseIteration"">2.1</span><u><span class=""grammatical_note"">no object</span></u> <span class=""ind"">Come together in agreement or alliance.</span><div class=""trg""></div><div class=""exg""><div class=""ex""><em>‘all of them must now align against the foe’</em></div></div><div class=""synonyms""><div class=""moreInfo""></div><div class=""exg""><div><strong class=""syn"">ally</strong><span class=""syn"">, affiliate, associate, join, side, sympathize, be in league, unite, combine, join, join up, join forces, form an alliance, team up, band together, cooperate, collaborate, throw in one's lot, make common cause</span></div></div></div></li></ul></p></div></li></ul></section>"
alleviate,"<section class=""gramb""><h3 class=""ps pos""><span class=""pos"">verb</span></h3><span class=""transitivity""><span class=""neutral"">[</span>with object<span class=""neutral"">]</span></span><ul class=""semb""><li><div class=""trg""><p><span class=""iteration""></span><span class=""ind"">Make (suffering, deficiency, or a problem) less severe.</span></p><span class=""indicators""></span><div class=""exg""><div class=""ex""><em>‘he couldn't prevent her pain, only alleviate it’</em></div></div><div class=""exg""><div class=""ex""><em>‘measures to alleviate unemployment’</em></div></div><div class=""synonyms""><div class=""moreInfo""></div><div class=""exg""><div><strong class=""syn"">reduce</strong><span class=""syn"">, ease, relieve, take the edge off, deaden, dull, diminish, lessen, weaken, lighten, attenuate, allay, assuage, palliate, damp, soothe, help, soften, temper, control, still, quell, quieten, quiet, tone down, blunt, dilute, moderate, mitigate, modify, abate, lull, pacify, placate, mollify, sweeten</span></div></div></div></div></li></ul></section>"
alluring,"<section class=""gramb""><h3 class=""ps pos""><span class=""pos"">adjective</span></h3><span class=""transitivity""></span><ul class=""semb""><li><div class=""trg""><p><span class=""iteration""></span><span class=""ind"">Powerfully and mysteriously attractive or fascinating; seductive.</span></p><span class=""indicators""></span><div class=""exg""><div class=""ex""><em>‘the town offers alluring shops and restaurants’</em></div></div><div class=""synonyms""><div class=""moreInfo""></div><div class=""exg""><div><strong class=""syn"">enticing</strong><span class=""syn"">, tempting, attractive, appealing, fetching, inviting, glamorous, captivating, seductive</span></div></div></div></div></li></ul></section>"
allusion,"<section class=""gramb""><h3 class=""ps pos""><span class=""pos"">noun</span></h3><span class=""transitivity""></span><ul class=""semb""><li><div class=""trg""><p><span class=""iteration"">1</span><span class=""ind"">An expression designed to call something to mind without mentioning it explicitly; an indirect or passing reference.</span></p><span class=""indicators""></span><div class=""exg""><div class=""ex""><em>‘an allusion to Shakespeare’</em></div></div><div class=""exg""><div class=""ex""><em>‘a classical allusion’</em></div></div><div class=""synonyms""><div class=""moreInfo""></div><div class=""exg""><div><strong class=""syn"">reference to</strong><span class=""syn"">, mention of, comment on, remark about, citation of, quotation of, hint at, intimation of, suggestion of</span></div></div></div><p><ul class=""subSenses""><li class=""subSense""><span class=""subsenseIteration"">1.1</span><u><span class=""grammatical_note"">mass noun</span></u> <span class=""ind"">The practice of making allusions.</span><div class=""trg""></div><div class=""exg""><div class=""ex""><em>‘the use of allusion’</em></div></div></li></ul></p></div></li></ul></section>"
altruism,"<section class=""gramb""><h3 class=""ps pos""><span class=""pos"">noun</span></h3><u><span class=""grammatical_note countability"">mass noun</span></u><span class=""transitivity""></span><ul class=""semb""><li><div class=""trg""><p><span class=""iteration"">1</span><span class=""ind"">Disinterested and selfless concern for the well-being of others.</span></p><span class=""indicators""></span><div class=""exg""><div class=""ex""><em>‘some may choose to work with vulnerable elderly people out of altruism’</em></div></div><div class=""synonyms""><div class=""moreInfo""></div><div class=""exg""><div><strong class=""syn"">unselfishness</strong><span class=""syn"">, selflessness, self-sacrifice, self-denial</span></div></div></div><p><ul class=""subSenses""><li class=""subSense""><span class=""subsenseIteration"">1.1</span><span class=""sense-regions domain_labels"">Zoology </span><span class=""ind"">Behaviour of an animal that benefits another at its own expense.</span><div class=""trg""></div><div class=""exg""><div class=""ex""><em>‘reciprocal altruism’</em></div></div></li></ul></p></div></li></ul></section>"
alumnus,"<section class=""gramb""><h3 class=""ps pos""><span class=""pos"">noun</span><span class=""pos-inflections""><span class=""inflection-text""><span>alumni</span></span></span></h3><span class=""transitivity""></span><ul class=""semb""><li><div class=""trg""><p><span class=""iteration"">1</span><span class=""ind"">A former pupil or student, especially a male one, of a particular school, college, or university.</span></p><span class=""indicators""></span><div class=""exg""><div class=""ex""><em>‘a Harvard alumnus’</em></div></div><div class=""exg""><div class=""ex""><em>‘a mixture of news about the University and articles by alumni’</em></div></div><p><ul class=""subSenses""><li class=""subSense""><span class=""subsenseIteration"">1.1</span><span class=""ind"">A former member of a group, company, or organization.</span><div class=""trg""></div><div class=""exg""><div class=""ex""><em>‘a Royal Ballet alumnus’</em></div></div><div class=""exg""><div class=""ex""><em>‘the Pop Idol alumnus revealed a hitherto hidden falsetto’</em></div></div></li></ul></p></div></li></ul></section>"
ambivalent,"<section class=""gramb""><h3 class=""ps pos""><span class=""pos"">adjective</span></h3><span class=""transitivity""></span><ul class=""semb""><li><div class=""trg""><p><span class=""iteration""></span><span class=""ind"">Having mixed feelings or contradictory ideas about something or someone.</span></p><span class=""indicators""></span><div class=""exg""><div class=""ex""><em>‘some loved her, some hated her, few were ambivalent about her’</em></div></div><div class=""exg""><div class=""ex""><em>‘an ambivalent attitude to Europe’</em></div></div><div class=""synonyms""><div class=""moreInfo""></div><div class=""exg""><div><strong class=""syn"">equivocal</strong><span class=""syn"">, uncertain, unsure, doubtful, indecisive, inconclusive, irresolute, in two minds, undecided, unresolved, in a dilemma, on the horns of a dilemma, in a quandary, on the fence, torn, hesitating, fluctuating, wavering, vacillating, equivocating, mixed</span></div></div></div></div></li></ul></section>"
amply,"<section class=""gramb""><h3 class=""ps pos""><span class=""pos"">adverb</span></h3><span class=""transitivity""></span><ul class=""semb""><li><div class=""trg""><p><span class=""iteration""></span><span class=""ind"">Enough or more than enough; plentifully.</span></p><span class=""indicators""></span><div class=""exg""><div class=""ex""><em>‘the persistent reader is amply rewarded’</em></div></div></div></li></ul></section>"
anemia,
anesthesia,
anesthetic,
anew,"<section class=""gramb""><h3 class=""ps pos""><span class=""pos"">adverb</span></h3><span class=""transitivity""></span><ul class=""semb""><li><div class=""trg""><p><span class=""iteration"">1</span><span class=""sense-registers"">literary </span><span class=""ind"">In a new or different and typically more positive way.</span></p><span class=""indicators""></span><div class=""exg""><div class=""ex""><em>‘her career had begun anew, with a lucrative Japanese modelling contract’</em></div></div><p><ul class=""subSenses""><li class=""subSense""><span class=""subsenseIteration"">1.1</span><span class=""ind"">Once more; again.</span><div class=""trg""></div><div class=""exg""><div class=""ex""><em>‘tears filled her eyes anew’</em></div></div><div class=""synonyms""><div class=""moreInfo""></div><div class=""exg""><div><strong class=""syn"">again</strong><span class=""syn"">, once more, once again, a second time, afresh, over again</span></div></div></div></li></ul></p></div></li></ul></section>"
animosity,"<section class=""gramb""><h3 class=""ps pos""><span class=""pos"">noun</span><span class=""pos-inflections""><span class=""inflection-text""><span>animosities</span></span></span></h3><u><span class=""grammatical_note countability"">mass noun</span></u><span class=""transitivity""></span><ul class=""semb""><li><div class=""trg""><p><span class=""iteration""></span><span class=""ind"">Strong hostility.</span></p><span class=""indicators""></span><div class=""exg""><div class=""ex""><em>‘he no longer felt any animosity towards her’</em></div></div><div class=""synonyms""><div class=""moreInfo""></div><div class=""exg""><div><strong class=""syn"">antipathy</strong><span class=""syn"">, hostility, friction, antagonism, enmity, animus, opposition, aversion, acrimony, bitterness, rancour, resentment, dislike, ill feeling, bad feeling, ill will, bad blood, hatred, hate, loathing, detestation, abhorrence, odium</span></div></div></div></div></li></ul></section>"
annex,"<section class=""gramb""><h3 class=""ps pos""><span class=""pos"">verb</span></h3><span class=""transitivity""><span class=""neutral"">[</span>with object<span class=""neutral"">]</span></span><ul class=""semb""><li><div class=""trg""><p><span class=""iteration"">1</span><span class=""ind"">Add as an extra or subordinate part, especially to a document.</span></p><span class=""indicators""></span><div class=""exg""><div class=""ex""><em>‘the first ten amendments were annexed to the Constitution in 1791’</em></div></div><p><ul class=""subSenses""><li class=""subSense""><span class=""subsenseIteration"">1.1</span><span class=""sense-registers"">archaic </span><span class=""ind"">Add or attach as a condition or consequence.</span><div class=""trg""></div><div class=""exg""><div class=""ex""><em>‘extreme anointing hath neither ordinance of God to be grounded on, nor promise of grace annexed’</em></div></div><div class=""synonyms""><div class=""moreInfo""></div><div class=""exg""><div><strong class=""syn"">add</strong><span class=""syn"">, append, attach, join</span></div></div></div></li></ul></p></div></li><li><div class=""trg""><p><span class=""iteration"">2</span><span class=""ind"">Add (territory) to one's own territory by appropriation.</span></p><span class=""indicators""></span><div class=""exg""><div class=""ex""><em>‘the left bank of the Rhine was annexed by France in 1797’</em></div></div><div class=""synonyms""><div class=""moreInfo""></div><div class=""exg""><div><strong class=""syn"">take over</strong><span class=""syn"">, take possession of, appropriate, expropriate, arrogate, seize, conquer, occupy, garrison</span></div></div></div></div></li></ul></section><hr><section class=""gramb""><h3 class=""ps pos""><span class=""pos"">noun</span><span class=""pos-inflections""><span class=""inflection-text""><span>annexes</span></span></span></h3><span class=""transitivity""></span><ul class=""semb""><li><div class=""trg""><p><span class=""iteration"">1</span><span class=""ind"">A building joined to or associated with a main building, providing additional space or accommodation.</span></p><span class=""indicators""></span><div class=""exg""><div class=""ex""><em>‘the school's one-storey wooden annex’</em></div></div><div class=""synonyms""><div class=""moreInfo""></div><div class=""exg""><div><strong class=""syn"">part</strong><span class=""syn"">, section, side</span></div></div></div></div></li><li><div class=""trg""><p><span class=""iteration"">2</span><span class=""ind"">An addition to a document.</span></p><span class=""indicators""></span><div class=""exg""><div class=""ex""><em>‘an annex to the report’</em></div></div><div class=""synonyms""><div class=""moreInfo""></div><div class=""exg""><div><strong class=""syn"">extension</strong><span class=""syn"">, supplementary building, addition, annexe</span></div></div></div></div></li></ul></section>"
annuity,"<section class=""gramb""><h3 class=""ps pos""><span class=""pos"">noun</span><span class=""pos-inflections""><span class=""inflection-text""><span>annuities</span></span></span></h3><span class=""transitivity""></span><ul class=""semb""><li><div class=""trg""><p><span class=""iteration"">1</span><span class=""ind"">A fixed sum of money paid to someone each year, typically for the rest of their life.</span></p><span class=""indicators""></span><div class=""exg""><div class=""ex""><em>‘he left her an annuity of £1,000 in his will’</em></div></div><div class=""synonyms""><div class=""moreInfo""></div><div class=""exg""><div><strong class=""syn"">payment</strong><span class=""syn"">, pocket money, sum of money, remittance, contribution, consideration, handout, grant, subsidy, maintenance, financial support, subsistence, benefit, stipend, pension, annuity, keep, upkeep, expenses</span></div></div></div><p><ul class=""subSenses""><li class=""subSense""><span class=""subsenseIteration"">1.1</span><span class=""ind"">A form of insurance or investment entitling the investor to a series of annual sums.</span><div class=""trg""></div><div class=""exg""><div class=""ex""><em>‘loans secured on an older person's home which are used to purchase a life annuity’</em></div></div><div class=""exg""><div class=""ex""><u><span class=""grammatical_note"">as modifier</span></u> <em>‘an annuity scheme’</em></div></div></li></ul></p></div></li></ul></section>"
annul,"<section class=""gramb""><h3 class=""ps pos""><span class=""pos"">verb</span><span class=""pos-inflections""><span class=""inflection-text""><span>annuls, </span></span><span class=""inflection-text""><span>annulling, </span></span><span class=""inflection-text""><span>annulled</span></span></span></h3><span class=""transitivity""><span class=""neutral"">[</span>with object<span class=""neutral"">]</span></span><ul class=""semb""><li><div class=""trg""><p><span class=""iteration"">1</span><span class=""ind"">Declare invalid (an official agreement, decision, or result)</span></p><span class=""indicators""></span><div class=""exg""><div class=""ex""><em>‘the elections were annulled by the general amid renewed protests’</em></div></div><div class=""synonyms""><div class=""moreInfo""></div><div class=""exg""><div><strong class=""syn"">declare invalid</strong><span class=""syn"">, declare null and void, nullify, invalidate, void</span></div></div></div><p><ul class=""subSenses""><li class=""subSense""><span class=""subsenseIteration"">1.1</span><span class=""ind"">Declare (a marriage) to have had no legal existence.</span><div class=""trg""></div><div class=""exg""><div class=""ex""><em>‘her first marriage was finally annulled by His Holiness’</em></div></div></li></ul></p></div></li></ul></section>"
anomaly,"<section class=""gramb""><h3 class=""ps pos""><span class=""pos"">noun</span><span class=""pos-inflections""><span class=""inflection-text""><span>anomalies</span></span></span></h3><span class=""transitivity""></span><ul class=""semb""><li><div class=""trg""><p><span class=""iteration"">1</span><span class=""ind"">Something that deviates from what is standard, normal, or expected.</span></p><span class=""indicators""></span><div class=""exg""><div class=""ex""><em>‘there are a number of anomalies in the present system’</em></div></div><div class=""exg""><div class=""ex""><u><span class=""grammatical_note"">with clause</span></u> <em>‘the apparent anomaly that those who produced the wealth were the poorest’</em></div></div><div class=""exg""><div class=""ex""><u><span class=""grammatical_note"">mass noun</span></u> <em>‘the position abounds in anomaly’</em></div></div><div class=""synonyms""><div class=""moreInfo""></div><div class=""exg""><div><strong class=""syn"">oddity</strong><span class=""syn"">, peculiarity, abnormality, irregularity, inconsistency, incongruity, deviation, aberration, quirk, freak, exception, departure, divergence, variation</span></div></div></div></div></li><li><div class=""trg""><p><span class=""iteration"">2</span><span class=""sense-regions domain_labels"">Astronomy </span><br/><span class=""ind"">The angular distance of a planet or satellite from its last perihelion or perigee.</span></p><span class=""indicators""></span></div></li></ul></section>"
ante,"<section class=""gramb""><h3 class=""ps pos""><span class=""pos"">noun</span></h3><span class=""transitivity""></span><ul class=""semb""><li><div class=""trg""><p><span class=""iteration""></span><span class=""ind"">A stake put up by a player in poker or brag before receiving cards.</span></p><span class=""indicators""></span><div class=""exg""><div class=""ex""><em>‘the antes were at the $10,000–$20,000 level’</em></div></div><div class=""synonyms""><div class=""moreInfo""></div><div class=""exg""><div><strong class=""syn"">wager</strong><span class=""syn"">, stake, gamble, ante</span></div></div></div></div></li></ul></section><hr><section class=""gramb""><h3 class=""ps pos""><span class=""pos"">verb</span><span class=""pos-inflections""><span class=""inflection-text""><span>antes, </span></span><span class=""inflection-text""><span>anteing, </span></span><span class=""inflection-text""><span>anted</span></span></span></h3><span class=""transitivity""><span class=""neutral"">[</span>with object<span class=""neutral"">]</span></span><span class=""form-groups""><strong>ante something up</strong></span> <ul class=""semb""><li><div class=""trg""><p><span class=""iteration"">1</span><span class=""ind"">Put up an amount as an ante in poker or brag and similar games.</span></p><span class=""indicators""></span><div class=""exg""><div class=""ex""><em>‘He essentially gets to pick which bets he thinks are best, and ante them up.’</em></div></div><div class=""synonyms""><div class=""moreInfo""></div><div class=""exg""><div><strong class=""syn"">give</strong><span class=""syn"">, donate, give a donation of, make a donation of, put up, come up with, subscribe, hand out, grant, bestow, present, gift, accord</span></div></div></div><p><ul class=""subSenses""><li class=""subSense""><span class=""subsenseIteration"">1.1</span><span class=""sense-regions spanish_label"">North American </span><span class=""sense-registers"">informal </span><span class=""ind"">Pay an amount of money in advance.</span><div class=""trg""></div><div class=""exg""><div class=""ex""><em>‘he anted up $925,000 of his own money’</em></div></div><div class=""exg""><div class=""ex""><u><span class=""grammatical_note"">no object</span></u> <em>‘the owners have to ante up if they want to attract the best talent’</em></div></div><div class=""synonyms""><div class=""moreInfo""></div><div class=""exg""><div><strong class=""syn"">pay</strong><span class=""syn"">, pay up, hand over, part with, give, put in, contribute, donate</span></div></div></div></li></ul></p></div></li></ul></section>"
anthem,"<section class=""gramb""><h3 class=""ps pos""><span class=""pos"">noun</span></h3><span class=""transitivity""></span><ul class=""semb""><li><div class=""trg""><p><span class=""iteration"">1</span><span class=""ind"">A rousing or uplifting song identified with a particular group, body, or cause.</span></p><span class=""indicators""></span><div class=""exg""><div class=""ex""><em>‘the song became the anthem for hippy activists’</em></div></div><p><ul class=""subSenses""><li class=""subSense""><span class=""subsenseIteration"">1.1</span><span class=""ind"">A solemn patriotic song officially adopted by a country as an expression of national identity.</span><div class=""trg""></div><div class=""exg""><div class=""ex""><em>‘the crowd stood and sang the national anthem’</em></div></div><div class=""exg""><div class=""ex""><em>‘we decided that the match would not have the anthems of either country as a prelude’</em></div></div></li></ul></p></div></li><li><div class=""trg""><p><span class=""iteration"">2</span><span class=""ind"">A musical setting of a religious text to be sung by a choir during a church service, especially in Anglican or Protestant Churches.</span></p><span class=""indicators""></span><div class=""synonyms""><div class=""moreInfo""></div><div class=""exg""><div><strong class=""syn"">hymn</strong><span class=""syn"">, song, song of praise, chorale, psalm, paean, plainsong, chant, canticle</span></div></div></div></div></li></ul></section>"
antidote,"<section class=""gramb""><h3 class=""ps pos""><span class=""pos"">noun</span></h3><span class=""transitivity""></span><ul class=""semb""><li><div class=""trg""><p><span class=""iteration"">1</span><span class=""ind"">A medicine taken or given to counteract a particular poison.</span></p><span class=""indicators""></span><div class=""exg""><div class=""ex""><em>‘there is no known antidote to the poison of the pufferfish’</em></div></div><div class=""synonyms""><div class=""moreInfo""></div><div class=""exg""><div><strong class=""syn"">antitoxin</strong><span class=""syn"">, antiserum</span></div></div></div><p><ul class=""subSenses""><li class=""subSense""><span class=""subsenseIteration"">1.1</span><span class=""ind"">Something that counteracts an unpleasant feeling or situation.</span><div class=""trg""></div><div class=""exg""><div class=""ex""><em>‘laughter is a good antidote to stress’</em></div></div><div class=""synonyms""><div class=""moreInfo""></div><div class=""exg""><div><strong class=""syn"">remedy</strong><span class=""syn"">, cure, corrective, nostrum, countermeasure, counteragent</span></div></div></div></li></ul></p></div></li></ul></section>"
antipathy,"<section class=""gramb""><h3 class=""ps pos""><span class=""pos"">noun</span><span class=""pos-inflections""><span class=""inflection-text""><span>antipathies</span></span></span></h3><u><span class=""grammatical_note countability"">mass noun</span></u><span class=""transitivity""></span><ul class=""semb""><li><div class=""trg""><p><span class=""iteration""></span><span class=""ind"">A deep-seated feeling of aversion.</span></p><span class=""indicators""></span><div class=""exg""><div class=""ex""><em>‘his fundamental antipathy to capitalism’</em></div></div><div class=""synonyms""><div class=""moreInfo""></div><div class=""exg""><div><strong class=""syn"">hostility</strong><span class=""syn"">, antagonism, animosity, aversion, animus, opposition, enmity, dislike, distaste, ill will, ill feeling, hatred, hate, abhorrence, loathing, repugnance, odium</span></div></div></div></div></li></ul></section>"
