diabetic,"<section class=""gramb""><h3 class=""ps pos""><span class=""pos"">adjective</span></h3><span class=""transitivity""></span><ul class=""semb""><li><div class=""trg""><p><span class=""iteration"">1</span><span class=""ind"">Having diabetes.</span></p><span class=""indicators""></span><p><ul class=""subSenses""><li class=""subSense""><span class=""subsenseIteration"">1.1</span><span class=""ind"">Relating to or designed to relieve diabetes.</span><div class=""trg""></div><div class=""exg""><div class=""ex""><em>‘a diabetic clinic’</em></div></div><div class=""exg""><div class=""ex""><em>‘a diabetic diet’</em></div></div></li></ul></p></div></li></ul></section><hr><section class=""gramb""><h3 class=""ps pos""><span class=""pos"">noun</span></h3><span class=""transitivity""></span><ul class=""semb""><li><div class=""trg""><p><span class=""iteration""></span><span class=""ind"">A person who has diabetes.</span></p><span class=""indicators""></span></div></li></ul></section>"
diaper,"<section class=""gramb""><h3 class=""ps pos""><span class=""pos"">noun</span></h3><span class=""transitivity""></span><ul class=""semb""><li><div class=""trg""><p><span class=""iteration"">1</span><span class=""sense-regions"">North American </span><span class=""ind"">A piece of towelling or other absorbent material wrapped round a baby's bottom and between its legs to absorb and retain urine and faeces; a nappy.</span></p><span class=""indicators""></span></div></li><li><div class=""trg""><p><span class=""iteration"">2</span><u><span class=""grammatical_note"">mass noun</span></u> <span class=""ind"">A linen or cotton fabric woven in a repeating pattern of small diamonds.</span></p><span class=""indicators""></span><div class=""exg""><div class=""ex""><em>‘Did you know that the word diaper is the name of the type of linen used to make what was then called a napkin or clout for a baby?’</em></div></div><p><ul class=""subSenses""><li class=""subSense""><span class=""subsenseIteration"">2.1</span><span class=""ind"">A repeating geometrical or floral pattern used to decorate a surface.</span><div class=""trg""></div></li></ul></p></div></li></ul></section><hr><section class=""gramb""><h3 class=""ps pos""><span class=""pos"">verb</span></h3><span class=""transitivity""><span class=""neutral"">[</span>with object<span class=""neutral"">]</span></span><ul class=""semb""><li><div class=""trg""><p><span class=""iteration"">1</span><span class=""sense-regions"">North American </span><span class=""ind"">Put a nappy on (a baby).</span></p><span class=""indicators""></span></div></li><li><div class=""trg""><p><span class=""iteration"">2</span><span class=""ind"">Decorate (a surface) with a repeating geometrical or floral pattern.</span></p><span class=""indicators""></span><div class=""exg""><div class=""ex""><em>‘The dating of the border, with its pale blue relief diapering, is interesting, since it indicates when this variation of the famille verte genre was popular.’</em></div></div></div></li></ul></section>"
dictum,"<section class=""gramb""><h3 class=""ps pos""><span class=""pos"">noun</span><span class=""pos-inflections""><span class=""inflection-text""><span>dicta, </span></span><span class=""inflection-text""><span>dictums</span></span></span></h3><span class=""transitivity""></span><ul class=""semb""><li><div class=""trg""><p><span class=""iteration"">1</span><span class=""ind"">A formal pronouncement from an authoritative source.</span></p><span class=""indicators""></span><div class=""exg""><div class=""ex""><em>‘the dicta of High Court Judges’</em></div></div><div class=""synonyms""><div class=""moreInfo""></div><div class=""exg""><div><strong class=""syn"">pronouncement</strong><span class=""syn"">, proclamation, direction, injunction, assertion, statement</span></div></div></div><p><ul class=""subSenses""><li class=""subSense""><span class=""subsenseIteration"">1.1</span><span class=""ind"">A short statement that expresses a general truth or principle.</span><div class=""trg""></div><div class=""exg""><div class=""ex""><em>‘the old dictum ‘might is right’’</em></div></div><div class=""synonyms""><div class=""moreInfo""></div><div class=""exg""><div><strong class=""syn"">saying</strong><span class=""syn"">, maxim, axiom, proverb, adage, aphorism, saw, precept, epigram, epigraph, motto, truism, platitude, commonplace</span></div></div></div></li><li class=""subSense""><span class=""subsenseIteration"">1.2</span><span class=""sense-regions domain_labels"">Law </span><div class=""no-definition""></div><div class=""trg""><div class=""crossReference"">short for <a>obiter dictum</a></div></div></li></ul></p></div></li></ul></section>"
dire,"<section class=""gramb""><h3 class=""ps pos""><span class=""pos"">adjective</span></h3><span class=""transitivity""></span><ul class=""semb""><li><div class=""trg""><p><span class=""iteration"">1</span><span class=""ind"">Extremely serious or urgent.</span></p><span class=""indicators""></span><div class=""exg""><div class=""ex""><em>‘misuse of drugs can have dire consequences’</em></div></div><div class=""exg""><div class=""ex""><em>‘he was in dire need of help’</em></div></div><div class=""synonyms""><div class=""moreInfo""></div><div class=""exg""><div><strong class=""syn"">terrible</strong><span class=""syn"">, dreadful, appalling, frightful, awful, horrible, atrocious, grim, unspeakable, distressing, harrowing, alarming, shocking, outrageous</span></div><div><strong class=""syn"">urgent</strong><span class=""syn"">, desperate, pressing, crying, sore, grave, serious, extreme, acute, drastic</span></div></div></div><p><ul class=""subSenses""><li class=""subSense""><span class=""subsenseIteration"">1.1</span><span class=""ind"">(of a warning or threat) presaging disaster.</span><div class=""trg""></div><div class=""exg""><div class=""ex""><em>‘there were dire warnings from the traffic organizations’</em></div></div><div class=""synonyms""><div class=""moreInfo""></div><div class=""exg""><div><strong class=""syn"">ominous</strong><span class=""syn"">, portentous, gloomy, doom and gloom, sinister</span></div></div></div></li></ul></p></div></li><li><div class=""trg""><p><span class=""iteration"">2</span><span class=""sense-regions"">British </span><span class=""sense-registers"">informal </span><span class=""ind"">Of a very poor quality.</span></p><span class=""indicators""></span><div class=""exg""><div class=""ex""><em>‘the concert was dire’</em></div></div><div class=""synonyms""><div class=""moreInfo""></div><div class=""exg""><div><strong class=""syn"">substandard</strong><span class=""syn"">, below standard, below par, bad, deficient, defective, faulty, imperfect, inferior, mediocre</span></div></div></div></div></li></ul></section>"
disband,"<section class=""gramb""><h3 class=""ps pos""><span class=""pos"">verb</span></h3><span class=""transitivity""></span><ul class=""semb""><li><div class=""trg""><p><span class=""iteration""></span><span class=""ind"">(with reference to an organized group) break up or cause to break up.</span></p><span class=""indicators""></span><div class=""exg""><div class=""ex""><u><span class=""grammatical_note"">no object</span></u> <em>‘the unit was scheduled to disband’</em></div></div><div class=""exg""><div class=""ex""><u><span class=""grammatical_note"">with object</span></u> <em>‘from today the choir shall be disbanded’</em></div></div><div class=""synonyms""><div class=""moreInfo""></div><div class=""exg""><div><strong class=""syn"">break up</strong><span class=""syn"">, disperse, demobilize, dissolve, scatter, separate, go separate ways, part company</span></div></div></div></div></li></ul></section>"
discretionary,"<section class=""gramb""><h3 class=""ps pos""><span class=""pos"">adjective</span></h3><span class=""transitivity""></span><ul class=""semb""><li><div class=""trg""><p><span class=""iteration"">1</span><span class=""ind"">Available for use at the discretion of the user.</span></p><span class=""indicators""></span><div class=""exg""><div class=""ex""><em>‘there has been an increase in year-end discretionary bonuses’</em></div></div><div class=""synonyms""><div class=""moreInfo""></div><div class=""exg""><div><strong class=""syn"">optional</strong><span class=""syn"">, non-compulsory, voluntary, at one's discretion, up to the individual, non-mandatory, elective, open to choice</span></div></div></div><p><ul class=""subSenses""><li class=""subSense""><span class=""subsenseIteration"">1.1</span><span class=""ind"">Denoting or relating to investment funds placed with a broker or manager who has discretion to invest them on the client's behalf.</span><div class=""trg""></div><div class=""exg""><div class=""ex""><em>‘discretionary portfolios’</em></div></div></li></ul></p></div></li></ul></section>"
disgruntled,"<section class=""gramb""><h3 class=""ps pos""><span class=""pos"">adjective</span></h3><span class=""transitivity""></span><ul class=""semb""><li><div class=""trg""><p><span class=""iteration""></span><span class=""ind"">Angry or dissatisfied.</span></p><span class=""indicators""></span><div class=""exg""><div class=""ex""><em>‘judges receive letters from disgruntled members of the public’</em></div></div><div class=""synonyms""><div class=""moreInfo""></div><div class=""exg""><div><strong class=""syn"">dissatisfied</strong><span class=""syn"">, discontented, aggrieved, resentful, fed up, displeased, unhappy, disappointed, disaffected, malcontent</span></div></div></div></div></li></ul></section>"
disintegration,"<section class=""gramb""><h3 class=""ps pos""><span class=""pos"">noun</span></h3><u><span class=""grammatical_note countability"">mass noun</span></u><span class=""transitivity""></span><ul class=""semb""><li><div class=""trg""><p><span class=""iteration"">1</span><span class=""ind"">The process of losing cohesion or strength.</span></p><span class=""indicators""></span><div class=""exg""><div class=""ex""><em>‘the twin problems of economic failure and social disintegration’</em></div></div><div class=""synonyms""><div class=""moreInfo""></div><div class=""exg""><div><strong class=""syn"">fiasco</strong><span class=""syn"">, failure, catastrophe, disaster, disintegration, mess, wreck, ruin</span></div></div></div></div></li><li><div class=""trg""><p><span class=""iteration"">2</span><span class=""ind"">The process of coming to pieces.</span></p><span class=""indicators""></span><div class=""exg""><div class=""ex""><em>‘the disintegration of infected cells’</em></div></div><p><ul class=""subSenses""><li class=""subSense""><span class=""subsenseIteration"">2.1</span><span class=""sense-regions domain_labels"">Physics </span><span class=""ind"">A process in which a nucleus or other subatomic particle emits a smaller particle or divides into smaller particles.</span><div class=""trg""></div><div class=""synonyms""><div class=""moreInfo""></div><div class=""exg""><div><strong class=""syn"">wearing away</strong><span class=""syn"">, abrasion, scraping away, grinding down, crumbling, wear and tear, weathering, dissolving, dissolution</span></div></div></div></li></ul></p></div></li></ul></section>"
disparage,"<section class=""gramb""><h3 class=""ps pos""><span class=""pos"">verb</span></h3><span class=""transitivity""><span class=""neutral"">[</span>with object<span class=""neutral"">]</span></span><ul class=""semb""><li><div class=""trg""><p><span class=""iteration""></span><span class=""ind"">Regard or represent as being of little worth.</span></p><span class=""indicators""></span><div class=""exg""><div class=""ex""><em>‘he never missed an opportunity to disparage his competitors’</em></div></div><div class=""synonyms""><div class=""moreInfo""></div><div class=""exg""><div><strong class=""syn"">belittle</strong><span class=""syn"">, denigrate, deprecate, depreciate, downgrade, play down, deflate, trivialize, minimize, make light of, treat lightly, undervalue, underrate, underestimate</span></div><div><strong class=""syn"">derogatory</strong><span class=""syn"">, deprecating, deprecatory, denigratory, belittling, slighting, insulting, abusive</span></div></div></div></div></li></ul></section>"
disparate,"<section class=""gramb""><h3 class=""ps pos""><span class=""pos"">adjective</span></h3><span class=""transitivity""></span><ul class=""semb""><li><div class=""trg""><p><span class=""iteration"">1</span><span class=""ind"">Essentially different in kind; not able to be compared.</span></p><span class=""indicators""></span><div class=""exg""><div class=""ex""><em>‘they inhabit disparate worlds of thought’</em></div></div><div class=""synonyms""><div class=""moreInfo""></div><div class=""exg""><div><strong class=""syn"">contrasting</strong><span class=""syn"">, different, differing, dissimilar, unlike, unalike, poles apart</span></div></div></div><p><ul class=""subSenses""><li class=""subSense""><span class=""subsenseIteration"">1.1</span><span class=""ind"">Containing elements very different from one another.</span><div class=""trg""></div><div class=""exg""><div class=""ex""><em>‘a culturally disparate country’</em></div></div></li></ul></p></div></li></ul></section><hr><section class=""gramb""><h3 class=""ps pos""><span class=""pos"">noun</span></h3><span class=""transitivity""></span><span class=""sense-registers"">archaic </span><span class=""form-groups""><strong>disparates</strong></span> <ul class=""semb""><li><div class=""trg""><p><span class=""iteration""></span><span class=""ind"">Things so unlike that there is no basis for comparison.</span></p><span class=""indicators""></span><div class=""exg""><div class=""ex""><em>‘The second class of disparates have more to do with the particular foibles of the aperture involved.’</em></div></div><div class=""exg""><div class=""ex""><em>‘Here live disparates, renegades and various isolationists who don't want to join the greater Namqua society.’</em></div></div></div></li></ul></section>"
disparity,"<section class=""gramb""><h3 class=""ps pos""><span class=""pos"">noun</span><span class=""pos-inflections""><span class=""inflection-text""><span>disparities</span></span></span></h3><span class=""transitivity""></span><ul class=""semb""><li><div class=""trg""><p><span class=""iteration""></span><span class=""ind"">A great difference.</span></p><span class=""indicators""></span><div class=""exg""><div class=""ex""><em>‘economic disparities between different regions of the country’</em></div></div><div class=""exg""><div class=""ex""><u><span class=""grammatical_note"">mass noun</span></u> <em>‘the arrangements could lead to disparity of treatment between companies’</em></div></div><div class=""synonyms""><div class=""moreInfo""></div><div class=""exg""><div><strong class=""syn"">discrepancy</strong><span class=""syn"">, inconsistency, imbalance, inequality, incongruity, unevenness, disproportion</span></div></div></div></div></li></ul></section>"
disproportionate,"<section class=""gramb""><h3 class=""ps pos""><span class=""pos"">adjective</span></h3><span class=""transitivity""></span><ul class=""semb""><li><div class=""trg""><p><span class=""iteration""></span><span class=""ind"">Too large or too small in comparison with something else.</span></p><span class=""indicators""></span><div class=""exg""><div class=""ex""><em>‘people on lower incomes spend a disproportionate amount of their income on fuel’</em></div></div><div class=""exg""><div class=""ex""><em>‘persistent offenders were given sentences that were disproportionate to the offences they had committed’</em></div></div><div class=""synonyms""><div class=""moreInfo""></div><div class=""exg""><div><strong class=""syn"">out of proportion to</strong><span class=""syn"">, not in proportion to, not appropriate to, not commensurate with, relatively too large for, relatively too small for</span></div></div></div></div></li></ul></section><hr><section class=""gramb""><h3 class=""ps pos""><span class=""pos"">verb</span></h3><span class=""transitivity""><span class=""neutral"">[</span>no object<span class=""neutral"">]</span></span><span class=""sense-regions domain_labels"">Chemistry </span><br/><ul class=""semb""><li><div class=""trg""><p><span class=""iteration""></span><span class=""ind"">Undergo disproportionation.</span></p><span class=""indicators""></span><div class=""exg""><div class=""ex""><em>‘water disproportionates to oxygen and hydrogen’</em></div></div></div></li></ul></section>"
distraught,"<section class=""gramb""><h3 class=""ps pos""><span class=""pos"">adjective</span></h3><span class=""transitivity""></span><ul class=""semb""><li><div class=""trg""><p><span class=""iteration""></span><span class=""ind"">Very worried and upset.</span></p><span class=""indicators""></span><div class=""exg""><div class=""ex""><em>‘distraught parents looking for a runaway teenager’</em></div></div><div class=""exg""><div class=""ex""><em>‘he is terribly distraught’</em></div></div><div class=""synonyms""><div class=""moreInfo""></div><div class=""exg""><div><strong class=""syn"">worried</strong><span class=""syn"">, upset, distressed, fraught, devastated, shattered</span></div></div></div></div></li></ul></section>"
divulge,"<section class=""gramb""><h3 class=""ps pos""><span class=""pos"">verb</span></h3><span class=""transitivity""><span class=""neutral"">[</span>with object<span class=""neutral"">]</span></span><ul class=""semb""><li><div class=""trg""><p><span class=""iteration""></span><span class=""ind"">Make known (private or sensitive information)</span></p><span class=""indicators""></span><div class=""exg""><div class=""ex""><em>‘I do not want to divulge my plans at the moment’</em></div></div><div class=""synonyms""><div class=""moreInfo""></div><div class=""exg""><div><strong class=""syn"">disclose</strong><span class=""syn"">, reveal, make known, tell, impart, communicate, pass on, publish, broadcast, proclaim, promulgate, declare</span></div></div></div></div></li></ul></section>"
doctorate,"<section class=""gramb""><h3 class=""ps pos""><span class=""pos"">noun</span></h3><span class=""transitivity""></span><ul class=""semb""><li><div class=""trg""><p><span class=""iteration""></span><span class=""ind"">The highest degree awarded by a university faculty or other approved educational organization.</span></p><span class=""indicators""></span><div class=""exg""><div class=""ex""><em>‘a doctorate in art history’</em></div></div></div></li></ul></section>"
doe,"<section class=""gramb""><h3 class=""ps pos""><span class=""pos"">noun</span></h3><span class=""transitivity""></span><ul class=""semb""><li><div class=""trg""><p><span class=""iteration"">1</span><span class=""ind"">A female deer, especially a female roe, fallow deer, or reindeer.</span></p><span class=""indicators""></span><p><ul class=""subSenses""><li class=""subSense""><span class=""subsenseIteration"">1.1</span><span class=""ind"">A female hare, rabbit, rat, ferret, or kangaroo.</span><div class=""trg""></div><div class=""exg""><div class=""ex""><u><span class=""grammatical_note"">as modifier</span></u> <em>‘doe rabbits’</em></div></div></li></ul></p></div></li></ul></section><hr><section class=""gramb""><h3 class=""ps pos""><span class=""pos"">abbreviation</span></h3><span class=""transitivity""></span><ul class=""semb""><li><div class=""trg""><p><span class=""iteration""></span><span class=""ind"">(formerly in the UK) Department of the Environment.</span></p><span class=""indicators""></span></div></li></ul></section>"
dogged,"<section class=""gramb""><h3 class=""ps pos""><span class=""pos"">adjective</span></h3><span class=""transitivity""></span><ul class=""semb""><li><div class=""trg""><p><span class=""iteration""></span><span class=""ind"">Having or showing tenacity and grim persistence.</span></p><span class=""indicators""></span><div class=""exg""><div class=""ex""><em>‘success required dogged determination’</em></div></div><div class=""synonyms""><div class=""moreInfo""></div><div class=""exg""><div><strong class=""syn"">tenacious</strong><span class=""syn"">, determined, resolute, resolved, purposeful, persistent, persevering, pertinacious, relentless, intent, dead set, single-minded, focused, dedicated, committed, undeviating, unshakeable, unflagging, indefatigable, untiring, never-tiring, tireless, unfailing, unfaltering, unwavering, unyielding, unbending, immovable, obdurate, strong-willed, firm, steadfast, steady, staunch, stout-hearted</span></div></div></div></div></li></ul></section>"
dolly,"<section class=""gramb""><h3 class=""ps pos""><span class=""pos"">noun</span><span class=""pos-inflections""><span class=""inflection-text""><span>dollies</span></span></span></h3><span class=""transitivity""></span><ul class=""semb""><li><div class=""trg""><p><span class=""iteration"">1</span><span class=""ind"">A child's word for a doll.</span></p><span class=""indicators""></span><div class=""synonyms""><div class=""moreInfo""></div><div class=""exg""><div><strong class=""syn"">puppet</strong><span class=""syn"">, marionette, figure, figurine, model</span></div></div></div><p><ul class=""subSenses""><li class=""subSense""><span class=""subsenseIteration"">1.1</span><span class=""sense-registers"">informal, dated </span><span class=""ind"">An attractive but unintelligent young woman.</span><div class=""trg""></div><div class=""exg""><div class=""ex""><em>‘It has recently come to my attention that you have been spuriously promising your vast readership pictures of young dolly songbirds in a state of total undress.’</em></div></div><div class=""exg""><div class=""ex""><em>‘Whether they were their wives or some dolly they picked up along the way is unclear.’</em></div></div></li></ul></p></div></li><li><div class=""trg""><p><span class=""iteration"">2</span><span class=""ind"">A small platform on wheels used for holding heavy objects, typically film or television cameras.</span></p><span class=""indicators""></span><div class=""exg""><div class=""ex""><u><span class=""grammatical_note"">as modifier</span></u> <em>‘a dolly shot’</em></div></div></div></li><li><div class=""trg""><p><span class=""iteration"">3</span><span class=""sense-regions domain_labels"">Cricket </span><br/><span class=""sense-registers"">informal </span><span class=""ind"">An easy catch.</span></p><span class=""indicators""></span><div class=""exg""><div class=""ex""><em>‘he fumbled a dolly at slip’</em></div></div></div></li><li><div class=""trg""><p><span class=""iteration"">4</span><span class=""sense-registers"">historical </span><span class=""ind"">A short wooden pole for stirring clothes in a washtub.</span></p><span class=""indicators""></span></div></li></ul></section><hr><section class=""gramb""><h3 class=""ps pos""><span class=""pos"">verb</span><span class=""pos-inflections""><span class=""inflection-text""><span>dollies, </span></span><span class=""inflection-text""><span>dollying, </span></span><span class=""inflection-text""><span>dollied</span></span></span></h3><span class=""transitivity""></span><u><span class=""grammatical_note"">no object, with adverbial of direction</span></u> <ul class=""semb""><li><div class=""trg""><p><span class=""iteration""></span><span class=""ind"">(of a film or television camera) be moved on a mobile platform in a specified direction.</span></p><span class=""indicators""></span><div class=""exg""><div class=""ex""><em>‘the camera dollies back to reveal hundreds of people’</em></div></div></div></li></ul></section>"
