flounder,"<section class=""gramb""><h3 class=""ps pos""><span class=""pos"">verb</span></h3><span class=""transitivity""><span class=""neutral"">[</span>no object<span class=""neutral"">]</span></span><ul class=""semb""><li><div class=""trg""><p><span class=""iteration"">1</span><span class=""ind"">Struggle or stagger clumsily in mud or water.</span></p><span class=""indicators""></span><div class=""exg""><div class=""ex""><em>‘he was floundering about in the shallow offshore waters’</em></div></div><div class=""synonyms""><div class=""moreInfo""></div><div class=""exg""><div><strong class=""syn"">struggle</strong><span class=""syn"">, thrash, thresh, flail, toss and turn, twist and turn, pitch, splash, stagger, stumble, falter, lurch, blunder, fumble, grope, squirm, writhe</span></div></div></div><p><ul class=""subSenses""><li class=""subSense""><span class=""subsenseIteration"">1.1</span><span class=""ind"">Struggle mentally; show or feel great confusion.</span><div class=""trg""></div><div class=""exg""><div class=""ex""><em>‘she floundered, not knowing quite what to say’</em></div></div><div class=""synonyms""><div class=""moreInfo""></div><div class=""exg""><div><strong class=""syn"">struggle mentally</strong><span class=""syn"">, be out of one's depth, be in the dark, have difficulty, be confounded, be confused, be dumbfounded</span></div></div></div></li><li class=""subSense""><span class=""subsenseIteration"">1.2</span><span class=""ind"">Be in serious difficulty.</span><div class=""trg""></div><div class=""exg""><div class=""ex""><em>‘many firms are floundering’</em></div></div><div class=""synonyms""><div class=""moreInfo""></div><div class=""exg""><div><strong class=""syn"">struggle financially</strong><span class=""syn"">, be in dire straits, face financial ruin, be in difficulties, face bankruptcy, face insolvency</span></div></div></div></li></ul></p></div></li></ul></section><hr><section class=""gramb""><h3 class=""ps pos""><span class=""pos"">noun</span></h3><span class=""transitivity""></span><ul class=""semb""><li><div class=""trg""><p><span class=""iteration"">1</span><span class=""ind"">A small flatfish that typically occurs in shallow coastal water.</span></p><p class=""note"">Families Pleuronectidae and Bothidae: several species, in particular the edible Platichthys flesus of European waters</p><span class=""indicators""></span><p><ul class=""subSenses""><li class=""subSense""><span class=""subsenseIteration"">1.1</span><span class=""form-groups""><strong>flounders</strong></span><span class=""ind"">A collective term for flatfishes other than soles.</span><div class=""trg""><div class=""crossReference"">See <a>flatfish</a></div></div></li></ul></p></div></li></ul></section>"
fluke,"<section class=""gramb""><h3 class=""ps pos""><span class=""pos"">noun</span></h3><span class=""transitivity""></span><ul class=""semb""><li><div class=""trg""><p><span class=""iteration""></span><span class=""ind"">An unlikely chance occurrence, especially a surprising piece of luck.</span></p><span class=""indicators""></span><div class=""exg""><div class=""ex""><em>‘their victory was a bit of a fluke’</em></div></div><div class=""synonyms""><div class=""moreInfo""></div><div class=""exg""><div><strong class=""syn"">chance</strong><span class=""syn"">, coincidence, accident, a twist of fate</span></div></div></div></div></li></ul></section><hr><section class=""gramb""><h3 class=""ps pos""><span class=""pos"">verb</span></h3><span class=""transitivity""><span class=""neutral"">[</span>with object<span class=""neutral"">]</span></span><ul class=""semb""><li><div class=""trg""><p><span class=""iteration""></span><span class=""ind"">Achieve (something) by luck rather than skill.</span></p><span class=""indicators""></span></div></li></ul></section><hr><section class=""gramb""><h3 class=""ps pos""><span class=""pos"">noun</span></h3><span class=""transitivity""></span><ul class=""semb""><li><div class=""trg""><p><span class=""iteration"">1</span><span class=""ind"">A parasitic flatworm which typically has suckers and hooks for attachment to the host. Some species are of veterinary or medical importance.</span></p><p class=""note"">Classes Trematoda and Monogenea, phylum Platyhelminthes. See  and <a>digenean</a> and  and  and <a>monogenean</a></p><span class=""indicators""></span></div></li><li><div class=""trg""><p><span class=""iteration"">2</span><span class=""sense-regions"">North American </span><span class=""sense-registers"">dialect </span><span class=""ind"">A flatfish, especially a flounder.</span></p><span class=""indicators""></span></div></li></ul></section><hr><section class=""gramb""><h3 class=""ps pos""><span class=""pos"">noun</span></h3><span class=""transitivity""></span><ul class=""semb""><li><div class=""trg""><p><span class=""iteration"">1</span><span class=""ind"">A broad triangular plate on the arm of an anchor.</span></p><span class=""indicators""></span></div></li><li><div class=""trg""><p><span class=""iteration"">2</span><span class=""ind"">Either of the lobes of a whale's tail.</span></p><span class=""indicators""></span></div></li></ul></section>"
fluorescent,"<section class=""gramb""><h3 class=""ps pos""><span class=""pos"">adjective</span></h3><span class=""transitivity""></span><ul class=""semb""><li><div class=""trg""><p><span class=""iteration"">1</span><span class=""ind"">(of a substance) having or showing fluorescence.</span></p><span class=""indicators""></span><div class=""exg""><div class=""ex""><em>‘a fluorescent dye’</em></div></div><div class=""synonyms""><div class=""moreInfo""></div><div class=""exg""><div><strong class=""syn"">gleaming</strong><span class=""syn"">, bright, illuminated, lit, lighted, ablaze, brilliant, lustrous, glowing, glinting, sparkling, coruscating, twinkling, flickering, glittering, glistening, shimmering, flashing, dazzling, glaring, luminous, luminescent, incandescent, phosphorescent, fluorescent</span></div></div></div><p><ul class=""subSenses""><li class=""subSense""><span class=""subsenseIteration"">1.1</span><span class=""ind"">Containing a fluorescent tube.</span><div class=""trg""></div><div class=""exg""><div class=""ex""><em>‘fluorescent lighting’</em></div></div></li></ul></p></div></li><li><div class=""trg""><p><span class=""iteration"">2</span><span class=""ind"">Vividly colourful.</span></p><span class=""indicators""></span><div class=""exg""><div class=""ex""><em>‘a fluorescent T-shirt’</em></div></div><div class=""synonyms""><div class=""moreInfo""></div><div class=""exg""><div><strong class=""syn"">shining</strong><span class=""syn"">, light, brilliant, vivid, blazing, dazzling, beaming, intense, glaring</span></div></div></div></div></li></ul></section><hr><section class=""gramb""><h3 class=""ps pos""><span class=""pos"">noun</span></h3><span class=""transitivity""></span><ul class=""semb""><li><div class=""trg""><p><span class=""iteration""></span><span class=""ind"">A fluorescent tube or lamp.</span></p><span class=""indicators""></span></div></li></ul></section>"
flurry,"<section class=""gramb""><h3 class=""ps pos""><span class=""pos"">noun</span><span class=""pos-inflections""><span class=""inflection-text""><span>flurries</span></span></span></h3><span class=""transitivity""></span><ul class=""semb""><li><div class=""trg""><p><span class=""iteration"">1</span><span class=""ind"">A small swirling mass of something, especially snow or leaves, moved by sudden gusts of wind.</span></p><span class=""indicators""></span><div class=""exg""><div class=""ex""><em>‘a flurry of snow’</em></div></div><div class=""synonyms""><div class=""moreInfo""></div><div class=""exg""><div><strong class=""syn"">swirl</strong><span class=""syn"">, whirl, eddy, billow, shower, gust, rush, burst, gale, squall, storm</span></div></div></div><p><ul class=""subSenses""><li class=""subSense""><span class=""subsenseIteration"">1.1</span><span class=""ind"">A sudden short period of activity or excitement.</span><div class=""trg""></div><div class=""exg""><div class=""ex""><em>‘there was a brief flurry of activity in the hall’</em></div></div><div class=""synonyms""><div class=""moreInfo""></div><div class=""exg""><div><strong class=""syn"">burst</strong><span class=""syn"">, outbreak, spurt, fit, spell, bout, rash, blaze, eruption</span></div><div><strong class=""syn"">fluster</strong><span class=""syn"">, fuss, bustle, whirl, stir, ferment, hubbub, commotion, hustle, tumult</span></div></div></div></li><li class=""subSense""><span class=""subsenseIteration"">1.2</span><span class=""ind"">A number of things arriving or happening suddenly and during the same period.</span><div class=""trg""></div><div class=""exg""><div class=""ex""><em>‘a flurry of editorials hostile to the government’</em></div></div><div class=""synonyms""><div class=""moreInfo""></div><div class=""exg""><div><strong class=""syn"">spate</strong><span class=""syn"">, wave, flood, deluge, torrent, stream, tide, avalanche, storm, shower, cascade</span></div></div></div></li></ul></p></div></li></ul></section><hr><section class=""gramb""><h3 class=""ps pos""><span class=""pos"">verb</span><span class=""pos-inflections""><span class=""inflection-text""><span>flurries, </span></span><span class=""inflection-text""><span>flurrying, </span></span><span class=""inflection-text""><span>flurried</span></span></span></h3><span class=""transitivity""></span><u><span class=""grammatical_note"">no object, with adverbial of direction</span></u> <ul class=""semb""><li><div class=""trg""><p><span class=""iteration"">1</span><span class=""ind"">(especially of snow or leaves) be moved in small swirling masses by sudden gusts of wind.</span></p><span class=""indicators""></span><div class=""exg""><div class=""ex""><em>‘gusts of snow flurried through the door’</em></div></div><div class=""synonyms""><div class=""moreInfo""></div><div class=""exg""><div><strong class=""syn"">swirl</strong><span class=""syn"">, whirl, eddy, billow, gust, blast, blow, rush, wind, churn, swish, spin, twist, spurt, surge, seethe, stream, flow, puff, squall, squirt, boil</span></div></div></div><p><ul class=""subSenses""><li class=""subSense""><span class=""subsenseIteration"">1.1</span><span class=""ind"">(of a person) move quickly in a busy or agitated way.</span><div class=""trg""></div><div class=""exg""><div class=""ex""><em>‘the waiter flurried between them’</em></div></div></li></ul></p></div></li></ul></section>"
flux,"<section class=""gramb""><h3 class=""ps pos""><span class=""pos"">noun</span></h3><span class=""transitivity""></span><ul class=""semb""><li><div class=""trg""><p><span class=""iteration"">1</span><u><span class=""grammatical_note"">mass noun</span></u> <span class=""ind"">The action or process of flowing or flowing out.</span></p><span class=""indicators""></span><div class=""exg""><div class=""ex""><em>‘the flux of ions across the membrane’</em></div></div><div class=""synonyms""><div class=""moreInfo""></div><div class=""exg""><div><strong class=""syn"">outflow</strong><span class=""syn"">, outpouring, outflowing, outrush, rush, current, flood, deluge, emission, discharge, issue</span></div></div></div><p><ul class=""subSenses""><li class=""subSense""><span class=""subsenseIteration"">1.1</span><span class=""sense-regions domain_labels"">Physics </span><span class=""ind"">The rate of flow of a fluid, radiant energy, or particles across a given area.</span><div class=""trg""></div><div class=""synonyms""><div class=""moreInfo""></div><div class=""exg""><div><strong class=""syn"">flow</strong><span class=""syn"">, movement, motion, transfer, course, passage, current, drift, circulation, trickle, stream, swirl, surge, sweep, gush, roll, rush, welling, spate, tide</span></div></div></div></li><li class=""subSense""><span class=""subsenseIteration"">1.2</span><span class=""ind"">The amount of radiation or particles incident on an area in a given time.</span><div class=""trg""></div></li><li class=""subSense""><span class=""subsenseIteration"">1.3</span><span class=""ind"">The total electric or magnetic field passing through a surface.</span><div class=""trg""></div></li></ul></p></div></li><li><div class=""trg""><p><span class=""iteration"">2</span><span class=""sense-regions domain_labels"">Medicine </span><br/><span class=""ind"">An abnormal discharge of blood or other matter from or within the body.</span></p><span class=""indicators""></span><div class=""synonyms""><div class=""moreInfo""></div><div class=""exg""><div><strong class=""syn"">discharge</strong><span class=""syn"">, outflowing, outpouring, outrush, rush, flood, deluge, issue, spurt, jet, cascade, stream, torrent, gush, outburst</span></div></div></div><p><ul class=""subSenses""><li class=""subSense""><span class=""subsenseIteration"">2.1</span><span class=""form-groups"">usually <strong>the flux</strong></span><span class=""sense-registers"">archaic </span><span class=""ind"">Diarrhoea or dysentery.</span><div class=""trg""></div><div class=""exg""><div class=""ex""><em>‘Both of them are ill with the flux.’</em></div></div></li></ul></p></div></li><li><div class=""trg""><p><span class=""iteration"">3</span><u><span class=""grammatical_note"">mass noun</span></u> <span class=""ind"">Continuous change.</span></p><span class=""indicators""></span><div class=""exg""><div class=""ex""><em>‘since the fall of the wall Berlin has been a city in flux’</em></div></div><div class=""exg""><div class=""ex""><em>‘the whole political system is in a state of flux’</em></div></div><div class=""synonyms""><div class=""moreInfo""></div><div class=""exg""><div><strong class=""syn"">continuous change</strong><span class=""syn"">, changeability, changeableness, variability, inconstancy, fluidity, instability, unsteadiness, unpredictability, irregularity, fitfulness, unreliability, fickleness</span></div></div></div></div></li><li><div class=""trg""><p><span class=""iteration"">4</span><span class=""ind"">A substance mixed with a solid to lower its melting point, used especially in soldering and brazing metals or to promote vitrification in glass or ceramics.</span></p><span class=""indicators""></span><p><ul class=""subSenses""><li class=""subSense""><span class=""subsenseIteration"">4.1</span><span class=""ind"">A substance added to a furnace during metal-smelting or glass-making which combines with impurities to form slag.</span><div class=""trg""></div></li></ul></p></div></li></ul></section><hr><section class=""gramb""><h3 class=""ps pos""><span class=""pos"">verb</span></h3><span class=""transitivity""><span class=""neutral"">[</span>with object<span class=""neutral"">]</span></span><ul class=""semb""><li><div class=""trg""><p><span class=""iteration""></span><span class=""ind"">Treat (a metal object) with a flux to promote melting.</span></p><span class=""indicators""></span></div></li></ul></section>"
fodder,"<section class=""gramb""><h3 class=""ps pos""><span class=""pos"">noun</span></h3><u><span class=""grammatical_note countability"">mass noun</span></u><span class=""transitivity""></span><ul class=""semb""><li><div class=""trg""><p><span class=""iteration"">1</span><span class=""ind"">Food, especially dried hay or straw, for cattle and other livestock.</span></p><span class=""indicators""></span><div class=""synonyms""><div class=""moreInfo""></div><div class=""exg""><div><strong class=""syn"">fodder</strong><span class=""syn"">, feed, food, foodstuff, herbage, pasturage</span></div></div></div><p><ul class=""subSenses""><li class=""subSense""><span class=""subsenseIteration"">1.1</span><span class=""ind"">A person or thing regarded only as material for a specific use.</span><div class=""trg""></div><div class=""exg""><div class=""ex""><em>‘young people ending up as factory fodder’</em></div></div></li></ul></p></div></li></ul></section><hr><section class=""gramb""><h3 class=""ps pos""><span class=""pos"">verb</span></h3><span class=""transitivity""><span class=""neutral"">[</span>with object<span class=""neutral"">]</span></span><ul class=""semb""><li><div class=""trg""><p><span class=""iteration""></span><span class=""ind"">Give fodder to (cattle or other livestock)</span></p><span class=""indicators""></span><div class=""exg""><div class=""ex""><em>‘the animals need foddering’</em></div></div></div></li></ul></section>"
fondle,"<section class=""gramb""><h3 class=""ps pos""><span class=""pos"">verb</span></h3><span class=""transitivity""><span class=""neutral"">[</span>with object<span class=""neutral"">]</span></span><ul class=""semb""><li><div class=""trg""><p><span class=""iteration""></span><span class=""ind"">Stroke or caress lovingly or erotically.</span></p><span class=""indicators""></span><div class=""exg""><div class=""ex""><em>‘he kissed and fondled her’</em></div></div><div class=""synonyms""><div class=""moreInfo""></div><div class=""exg""><div><strong class=""syn"">caress</strong><span class=""syn"">, stroke, pat, pet, pull, finger, touch, tickle, twiddle, play with, massage, knead</span></div></div></div></div></li></ul></section><hr><section class=""gramb""><h3 class=""ps pos""><span class=""pos"">noun</span></h3><span class=""transitivity""></span><ul class=""semb""><li><div class=""trg""><p><span class=""iteration""></span><span class=""ind"">An act of fondling.</span></p><span class=""indicators""></span><div class=""synonyms""><div class=""moreInfo""></div><div class=""exg""><div><strong class=""syn"">stroke</strong><span class=""syn"">, stroking, touch, touching, fondle, fondling, skim, pat, nuzzle, nuzzling, kiss</span></div></div></div></div></li></ul></section>"
footage,"<section class=""gramb""><h3 class=""ps pos""><span class=""pos"">noun</span></h3><u><span class=""grammatical_note countability"">mass noun</span></u><span class=""transitivity""></span><ul class=""semb""><li><div class=""trg""><p><span class=""iteration"">1</span><span class=""ind"">Part of a cinema or television film recording a particular event.</span></p><span class=""indicators""></span><div class=""exg""><div class=""ex""><em>‘film footage of the riot’</em></div></div></div></li><li><div class=""trg""><p><span class=""iteration"">2</span><span class=""ind"">Size or length measured in feet.</span></p><span class=""indicators""></span><div class=""exg""><div class=""ex""><em>‘the square footage of the room’</em></div></div><div class=""synonyms""><div class=""moreInfo""></div><div class=""exg""><div><strong class=""syn"">value</strong><span class=""syn"">, amount, quantity, area, length, height, depth, weight, width, range, acreage, footage, mileage, tonnage</span></div></div></div></div></li></ul></section>"
footing,"<section class=""gramb""><h3 class=""ps pos""><span class=""pos"">noun</span></h3><span class=""transitivity""></span><ul class=""semb""><li><div class=""trg""><p><span class=""iteration"">1</span><span class=""form-groups""><strong>one's footing</strong></span><span class=""ind"">A secure grip with one's feet.</span></p><span class=""indicators""></span><div class=""exg""><div class=""ex""><em>‘he suddenly lost his footing’</em></div></div><div class=""synonyms""><div class=""moreInfo""></div><div class=""exg""><div><strong class=""syn"">foothold</strong><span class=""syn"">, toehold, hold, grip, anchorage, purchase, secure position, firm contact, support</span></div></div></div></div></li><li><div class=""trg""><p><span class=""iteration"">2</span><u><span class=""grammatical_note"">in singular</span></u> <span class=""ind"">The basis on which something is established or operates.</span></p><span class=""indicators""></span><div class=""exg""><div class=""ex""><em>‘attempts to establish the shop on a firm financial footing’</em></div></div><div class=""synonyms""><div class=""moreInfo""></div><div class=""exg""><div><strong class=""syn"">basis</strong><span class=""syn"">, base, foundation, underpinning, support, cornerstone</span></div></div></div><p><ul class=""subSenses""><li class=""subSense""><span class=""subsenseIteration"">2.1</span><span class=""ind"">The position or status of a person in relation to others.</span><div class=""trg""></div><div class=""exg""><div class=""ex""><em>‘the suppliers are on an equal footing with the buyers’</em></div></div><div class=""synonyms""><div class=""moreInfo""></div><div class=""exg""><div><strong class=""syn"">standing</strong><span class=""syn"">, status, state, station, position, rank, grade</span></div></div></div></li></ul></p></div></li><li><div class=""trg""><p><span class=""iteration"">3</span><span class=""form-groups"">usually <strong>footings</strong></span><span class=""ind"">The foundations of a wall, usually with a course of brickwork wider than the base of the wall.</span></p><span class=""indicators""></span></div></li></ul></section>"
foray,"<section class=""gramb""><h3 class=""ps pos""><span class=""pos"">noun</span></h3><span class=""transitivity""></span><ul class=""semb""><li><div class=""trg""><p><span class=""iteration"">1</span><span class=""ind"">A sudden attack or incursion into enemy territory, especially to obtain something; a raid.</span></p><span class=""indicators""></span><div class=""exg""><div class=""ex""><em>‘the garrison made a foray against Richard's camp’</em></div></div><div class=""synonyms""><div class=""moreInfo""></div><div class=""exg""><div><strong class=""syn"">raid</strong><span class=""syn"">, attack, assault, incursion, swoop, strike, charge, sortie, sally, rush, onrush, push, thrust, onslaught, offensive, bombardment</span></div></div></div><p><ul class=""subSenses""><li class=""subSense""><span class=""subsenseIteration"">1.1</span><span class=""ind"">A brief but spirited attempt to become involved in a new activity or sphere.</span><div class=""trg""></div><div class=""exg""><div class=""ex""><em>‘my first foray into journalism’</em></div></div></li></ul></p></div></li></ul></section><hr><section class=""gramb""><h3 class=""ps pos""><span class=""pos"">verb</span></h3><span class=""transitivity""></span><u><span class=""grammatical_note"">no object, with adverbial of direction</span></u> <ul class=""semb""><li><div class=""trg""><p><span class=""iteration""></span><span class=""ind"">Make or go on a foray.</span></p><span class=""indicators""></span><div class=""exg""><div class=""ex""><em>‘the place into which they were forbidden to foray’</em></div></div></div></li></ul></section>"
forcing,"<section class=""gramb""><h3 class=""ps pos""><span class=""pos"">adjective</span></h3><span class=""transitivity""></span><span class=""sense-regions domain_labels"">Bridge </span><br/><ul class=""semb""><li><div class=""trg""><p><span class=""iteration""></span><span class=""ind"">(of a bid) requiring by convention a response from one's partner, no matter how weak their hand may be.</span></p><span class=""indicators""></span><div class=""exg""><div class=""ex""><em>‘an opening bid of two clubs is forcing to game’</em></div></div><div class=""synonyms""><div class=""moreInfo""></div><div class=""exg""><div><strong class=""syn"">forcing</strong><span class=""syn"">, compelling, exacting, extorting, extortion, demanding, requiring</span></div></div></div></div></li></ul></section>"
foreman,"<section class=""gramb""><h3 class=""ps pos""><span class=""pos"">noun</span><span class=""pos-inflections""><span class=""inflection-text""><span>foremen</span></span></span></h3><span class=""transitivity""></span><ul class=""semb""><li><div class=""trg""><p><span class=""iteration"">1</span><span class=""ind"">A male worker who supervises and directs other workers.</span></p><span class=""indicators""></span><div class=""synonyms""><div class=""moreInfo""></div><div class=""exg""><div><strong class=""syn"">supervisor</strong><span class=""syn"">, overseer, superintendent, manager, boss, team leader, line manager, controller</span></div></div></div></div></li><li><div class=""trg""><p><span class=""iteration"">2</span><span class=""ind"">(in a law court) a person who presides over a jury and speaks on its behalf.</span></p><span class=""indicators""></span></div></li></ul></section>"
