chaplain,"<section class=""gramb""><h3 class=""ps pos""><span class=""pos"">noun</span></h3><span class=""transitivity""></span><ul class=""semb""><li><div class=""trg""><p><span class=""iteration""></span><span class=""ind"">A member of the clergy attached to a private chapel, institution, ship, regiment, etc.</span></p><span class=""indicators""></span><div class=""exg""><div class=""ex""><em>‘a prison chaplain’</em></div></div></div></li></ul></section>"
charred,"<section class=""gramb""><h3 class=""ps pos""><span class=""pos"">adjective</span></h3><span class=""transitivity""></span><ul class=""semb""><li><div class=""trg""><p><span class=""iteration""></span><span class=""ind"">Burnt and blackened.</span></p><span class=""indicators""></span><div class=""exg""><div class=""ex""><em>‘charred remains’</em></div></div></div></li></ul></section>"
chasm,"<section class=""gramb""><h3 class=""ps pos""><span class=""pos"">noun</span></h3><span class=""transitivity""></span><ul class=""semb""><li><div class=""trg""><p><span class=""iteration"">1</span><span class=""ind"">A deep fissure in the earth's surface.</span></p><span class=""indicators""></span><div class=""exg""><div class=""ex""><em>‘a chasm a mile long’</em></div></div><div class=""exg""><div class=""ex""><em>‘he was engulfed in a chasm of despair’</em></div></div><div class=""synonyms""><div class=""moreInfo""></div><div class=""exg""><div><strong class=""syn"">gorge</strong><span class=""syn"">, abyss, canyon, ravine, gully, gulf, pass, defile, couloir, crevasse, cleft, rift, rent</span></div></div></div><p><ul class=""subSenses""><li class=""subSense""><span class=""subsenseIteration"">1.1</span><span class=""ind"">A profound difference between people, viewpoints, feelings, etc.</span><div class=""trg""></div><div class=""exg""><div class=""ex""><em>‘the chasm between rich and poor’</em></div></div><div class=""synonyms""><div class=""moreInfo""></div><div class=""exg""><div><strong class=""syn"">breach</strong><span class=""syn"">, gulf, rift</span></div></div></div></li></ul></p></div></li></ul></section>"
chasten,"<section class=""gramb""><h3 class=""ps pos""><span class=""pos"">verb</span></h3><span class=""transitivity""><span class=""neutral"">[</span>with object<span class=""neutral"">]</span></span><ul class=""semb""><li><div class=""trg""><p><span class=""iteration"">1</span><span class=""ind"">(of a rebuke or misfortune) have a restraining or moderating effect on.</span></p><span class=""indicators""></span><div class=""exg""><div class=""ex""><em>‘the director was somewhat chastened by his recent flops’</em></div></div><div class=""synonyms""><div class=""moreInfo""></div><div class=""exg""><div><strong class=""syn"">subdue</strong><span class=""syn"">, humble, cow, squash, deflate, flatten, bring down, bring low, take down a peg or two, humiliate, mortify</span></div></div></div><p><ul class=""subSenses""><li class=""subSense""><span class=""subsenseIteration"">1.1</span><span class=""sense-registers"">archaic </span><span class=""ind"">(especially of God) discipline; punish.</span><div class=""trg""></div><div class=""synonyms""><div class=""moreInfo""></div><div class=""exg""><div><strong class=""syn"">penalize</strong><span class=""syn"">, discipline, mete out punishment to, bring someone to book, teach someone a lesson, make an example of</span></div></div></div></li></ul></p></div></li></ul></section>"
chide,"<section class=""gramb""><h3 class=""ps pos""><span class=""pos"">verb</span><span class=""pos-inflections""><span class=""inflection-text""><span>chided, </span></span><span class=""inflection-text""><span>chid, </span></span><span class=""inflection-text""><span>chidden</span></span></span></h3><span class=""transitivity""><span class=""neutral"">[</span>with object<span class=""neutral"">]</span></span><ul class=""semb""><li><div class=""trg""><p><span class=""iteration""></span><span class=""ind"">Scold or rebuke.</span></p><span class=""indicators""></span><div class=""exg""><div class=""ex""><em>‘she chided him for not replying to her letters’</em></div></div><div class=""exg""><div class=""ex""><u><span class=""grammatical_note"">with direct speech</span></u> <em>‘‘Now, now,’ he chided’</em></div></div><div class=""synonyms""><div class=""moreInfo""></div><div class=""exg""><div><strong class=""syn"">scold</strong><span class=""syn"">, chastise, upbraid, berate, castigate, lambaste, rebuke, reprimand, reproach, reprove, admonish, remonstrate with, lecture, criticize, censure</span></div></div></div></div></li></ul></section>"
choreographer,"<section class=""gramb""><h3 class=""ps pos""><span class=""pos"">noun</span></h3><span class=""transitivity""></span><ul class=""semb""><li><div class=""trg""><p><span class=""iteration""></span><span class=""ind"">A person who composes the sequence of steps and moves for a performance of dance.</span></p><span class=""indicators""></span><div class=""exg""><div class=""ex""><em>‘a professional choreographer’</em></div></div></div></li></ul></section>"
chromosome,"<section class=""gramb""><h3 class=""ps pos""><span class=""pos"">noun</span></h3><span class=""transitivity""></span><span class=""sense-regions domain_labels"">Biology </span><br/><ul class=""semb""><li><div class=""trg""><p><span class=""iteration""></span><span class=""ind"">A threadlike structure of nucleic acids and protein found in the nucleus of most living cells, carrying genetic information in the form of genes.</span></p><span class=""indicators""></span></div></li></ul><p class=""note"">Each chromosome consists of a DNA double helix bearing a linear sequence of genes, coiled and recoiled around aggregated proteins (histones). Their number varies from species to species: humans have 22 pairs plus the two sex chromosomes (two X chromosomes in females, one X and one Y in males). During cell division each DNA strand is duplicated, and the chromosomes condense to become visible as distinct pairs of chromatids joined at the centromere</p></section>"
circumvent,"<section class=""gramb""><h3 class=""ps pos""><span class=""pos"">verb</span></h3><span class=""transitivity""><span class=""neutral"">[</span>with object<span class=""neutral"">]</span></span><ul class=""semb""><li><div class=""trg""><p><span class=""iteration"">1</span><span class=""ind"">Find a way around (an obstacle)</span></p><span class=""indicators""></span><div class=""exg""><div class=""ex""><em>‘if you come to an obstruction in a road you can seek to circumvent it’</em></div></div><div class=""synonyms""><div class=""moreInfo""></div><div class=""exg""><div><strong class=""syn"">avoid</strong><span class=""syn"">, get round, find a way round, evade, get past, bypass, sidestep, dodge</span></div></div></div><p><ul class=""subSenses""><li class=""subSense""><span class=""subsenseIteration"">1.1</span><span class=""ind"">Overcome (a problem or difficulty), typically in a clever and surreptitious way.</span><div class=""trg""></div><div class=""exg""><div class=""ex""><em>‘I found it quite easy to circumvent security’</em></div></div><div class=""exg""><div class=""ex""><em>‘it was always possible to circumvent the regulations’</em></div></div><div class=""synonyms""><div class=""moreInfo""></div><div class=""exg""><div><strong class=""syn"">avoid</strong><span class=""syn"">, get round, find a way round, evade, get past, bypass, sidestep, dodge</span></div></div></div></li><li class=""subSense""><span class=""subsenseIteration"">1.2</span><span class=""sense-registers"">archaic </span><span class=""ind"">Deceive; outwit.</span><div class=""trg""></div><div class=""exg""><div class=""ex""><em>‘he's circumvented her with some of his stories’</em></div></div><div class=""synonyms""><div class=""moreInfo""></div><div class=""exg""><div><strong class=""syn"">avoid</strong><span class=""syn"">, get round, find a way round, evade, get past, bypass, sidestep, dodge</span></div></div></div></li></ul></p></div></li></ul></section>"
citation,"<section class=""gramb""><h3 class=""ps pos""><span class=""pos"">noun</span></h3><span class=""transitivity""></span><ul class=""semb""><li><div class=""trg""><p><span class=""iteration"">1</span><span class=""ind"">A quotation from or reference to a book, paper, or author, especially in a scholarly work.</span></p><span class=""indicators""></span><div class=""exg""><div class=""ex""><em>‘the majority of the citations are to work published during the past twenty years’</em></div></div><div class=""synonyms""><div class=""moreInfo""></div><div class=""exg""><div><strong class=""syn"">quotation</strong><span class=""syn"">, quote, extract, excerpt, passage, line, piece</span></div></div></div><p><ul class=""subSenses""><li class=""subSense""><span class=""subsenseIteration"">1.1</span><span class=""sense-regions domain_labels"">Law </span><span class=""ind"">A reference to a previous case, used as guidance in the trying of comparable cases or in support of an argument.</span><div class=""trg""></div><div class=""exg""><div class=""ex""><em>‘this journal contains citations from all jurisdictions’</em></div></div><div class=""synonyms""><div class=""moreInfo""></div><div class=""exg""><div><strong class=""syn"">reference</strong><span class=""syn"">, allusion</span></div></div></div></li></ul></p></div></li><li><div class=""trg""><p><span class=""iteration"">2</span><span class=""ind"">A mention of a praiseworthy act in an official report, especially that of a member of the armed forces in wartime.</span></p><span class=""indicators""></span><div class=""exg""><div class=""ex""><em>‘the citation described him as an officer of extreme gallantry’</em></div></div><div class=""synonyms""><div class=""moreInfo""></div><div class=""exg""><div><strong class=""syn"">commendation</strong><span class=""syn"">, award, honour</span></div></div></div><p><ul class=""subSenses""><li class=""subSense""><span class=""subsenseIteration"">2.1</span><span class=""ind"">A note accompanying an award, describing the reasons for it.</span><div class=""trg""></div><div class=""exg""><div class=""ex""><em>‘a Nobel citation’</em></div></div><div class=""synonyms""><div class=""moreInfo""></div><div class=""exg""><div><strong class=""syn"">award</strong><span class=""syn"">, accolade, prize, honour, honourable mention, mention, citation, recognition</span></div></div></div></li></ul></p></div></li><li><div class=""trg""><p><span class=""iteration"">3</span><span class=""sense-regions"">North American </span><span class=""ind"">A summons to appear in court.</span></p><span class=""indicators""></span><div class=""exg""><div class=""ex""><em>‘a traffic citation’</em></div></div><div class=""synonyms""><div class=""moreInfo""></div><div class=""exg""><div><strong class=""syn"">summons</strong><span class=""syn"">, subpoena, writ, court order, process</span></div></div></div></div></li></ul></section>"
civility,"<section class=""gramb""><h3 class=""ps pos""><span class=""pos"">noun</span><span class=""pos-inflections""><span class=""inflection-text""><span>civilities</span></span></span></h3><u><span class=""grammatical_note countability"">mass noun</span></u><span class=""transitivity""></span><ul class=""semb""><li><div class=""trg""><p><span class=""iteration"">1</span><span class=""ind"">Formal politeness and courtesy in behaviour or speech.</span></p><span class=""indicators""></span><div class=""exg""><div class=""ex""><em>‘I hope we can treat each other with civility and respect’</em></div></div><div class=""synonyms""><div class=""moreInfo""></div><div class=""exg""><div><strong class=""syn"">courtesy</strong><span class=""syn"">, courteousness, politeness, good manners, mannerliness, gentlemanliness, chivalry, gallantry, graciousness, consideration, respect, gentility</span></div></div></div><p><ul class=""subSenses""><li class=""subSense""><span class=""subsenseIteration"">1.1</span><span class=""form-groups""><strong>civilities</strong></span><span class=""ind"">Polite remarks used in formal conversation.</span><div class=""trg""></div><div class=""exg""><div class=""ex""><em>‘she was exchanging civilities with his mother’</em></div></div><div class=""synonyms""><div class=""moreInfo""></div><div class=""exg""><div><strong class=""syn"">polite remark</strong><span class=""syn"">, politeness, courtesy</span></div></div></div></li></ul></p></div></li></ul></section>"
clamor,
clamp,"<section class=""gramb""><h3 class=""ps pos""><span class=""pos"">noun</span></h3><span class=""transitivity""></span><ul class=""semb""><li><div class=""trg""><p><span class=""iteration"">1</span><span class=""ind"">A brace, band, or clasp for strengthening or holding things together.</span></p><span class=""indicators""></span><div class=""exg""><div class=""ex""><em>‘I have fixed the motor to the table with two clamps’</em></div></div><div class=""synonyms""><div class=""moreInfo""></div><div class=""exg""><div><strong class=""syn"">brace</strong><span class=""syn"">, vice, press</span></div></div></div><p><ul class=""subSenses""><li class=""subSense""><span class=""subsenseIteration"">1.1</span><div class=""no-definition""></div><div class=""trg""><div class=""crossReference"">short for <a>wheel clamp</a></div></div><div class=""synonyms""><div class=""moreInfo""></div><div class=""exg""><div><strong class=""syn"">immobilizer</strong><span class=""syn"">, wheel clamp</span></div></div></div></li></ul></p></div></li><li><div class=""trg""><p><span class=""iteration"">2</span><span class=""ind"">An electric circuit which serves to maintain the voltage limits of a signal at prescribed levels.</span></p><span class=""indicators""></span></div></li></ul></section><hr><section class=""gramb""><h3 class=""ps pos""><span class=""pos"">verb</span></h3><span class=""transitivity""></span><ul class=""semb""><li><div class=""trg""><p><span class=""iteration"">1</span><u><span class=""grammatical_note"">with object and adverbial of place</span></u> <span class=""ind"">Fasten (something) in place with a clamp.</span></p><span class=""indicators""></span><div class=""exg""><div class=""ex""><em>‘the sander is clamped on to the edge of a workbench’</em></div></div><div class=""synonyms""><div class=""moreInfo""></div><div class=""exg""><div><strong class=""syn"">fasten</strong><span class=""syn"">, secure, fix, clip, attach, make fast</span></div></div></div><p><ul class=""subSenses""><li class=""subSense""><span class=""subsenseIteration"">1.1</span><span class=""ind"">Fasten (two things) firmly together.</span><div class=""trg""></div><div class=""exg""><div class=""ex""><em>‘the two frames are clamped together’</em></div></div></li><li class=""subSense""><span class=""subsenseIteration"">1.2</span><span class=""ind"">Hold (something) tightly against another thing.</span><div class=""trg""></div><div class=""exg""><div class=""ex""><em>‘Maggie had to clamp a hand over her mouth to stop herself from laughing’</em></div></div><div class=""synonyms""><div class=""moreInfo""></div><div class=""exg""><div><strong class=""syn"">clench</strong><span class=""syn"">, grip, hold, press, squeeze</span></div></div></div></li><li class=""subSense""><span class=""subsenseIteration"">1.3</span><u><span class=""grammatical_note"">with object</span></u> <span class=""ind"">Immobilize (an unlawfully parked car) by fixing a wheel clamp to one of its wheels.</span><div class=""trg""></div><div class=""exg""><div class=""ex""><em>‘he had flown into a rage when he found his car was clamped’</em></div></div><div class=""synonyms""><div class=""moreInfo""></div><div class=""exg""><div><strong class=""syn"">immobilize</strong><span class=""syn"">, wheel-clamp</span></div></div></div></li></ul></p></div></li><li><div class=""trg""><p><span class=""iteration"">2</span><u><span class=""grammatical_note"">with object</span></u> <span class=""ind"">Maintain the voltage limits of (an electrical signal) at prescribed values.</span></p><span class=""indicators""></span></div></li></ul></section><hr><section class=""gramb""><h3 class=""ps pos""><span class=""pos"">noun</span></h3><span class=""transitivity""></span><span class=""sense-regions spanish_label"">British </span><ul class=""semb""><li><div class=""trg""><p><span class=""iteration"">1</span><span class=""ind"">A heap of potatoes or other root vegetables stored under straw or earth.</span></p><span class=""indicators""></span><div class=""exg""><div class=""ex""><em>‘There is also a theory about making a potato clamp to keep them in over the winter.’</em></div></div><div class=""exg""><div class=""ex""><em>‘From his own patch he had harvested potatoes the previous summer and had laid them in a clamp.’</em></div></div></div></li><li><div class=""trg""><p><span class=""iteration"">2</span><span class=""ind"">A three-sided structure used to store silage.</span></p><span class=""indicators""></span><div class=""exg""><div class=""ex""><em>‘a silage clamp’</em></div></div></div></li></ul></section>"
clandestine,"<section class=""gramb""><h3 class=""ps pos""><span class=""pos"">adjective</span></h3><span class=""transitivity""></span><ul class=""semb""><li><div class=""trg""><p><span class=""iteration""></span><span class=""ind"">Kept secret or done secretively, especially because illicit.</span></p><span class=""indicators""></span><div class=""exg""><div class=""ex""><em>‘she deserved better than these clandestine meetings’</em></div></div><div class=""synonyms""><div class=""moreInfo""></div><div class=""exg""><div><strong class=""syn"">secret</strong><span class=""syn"">, covert, furtive, surreptitious, stealthy, cloak-and-dagger, hole-and-corner, hole-in-the-corner, closet, behind-the-scenes, backstairs, back-alley, under-the-table, hugger-mugger, concealed, hidden, private</span></div></div></div></div></li></ul></section>"
cleric,"<section class=""gramb""><h3 class=""ps pos""><span class=""pos"">noun</span></h3><span class=""transitivity""></span><ul class=""semb""><li><div class=""trg""><p><span class=""iteration""></span><span class=""ind"">A priest or religious leader, especially a Christian or Muslim one.</span></p><span class=""indicators""></span></div></li></ul></section>"
clientele,"<section class=""gramb""><h3 class=""ps pos""><span class=""pos"">noun</span></h3><span class=""transitivity""></span><u><span class=""grammatical_note"">treated as singular or plural</span></u> <ul class=""semb""><li><div class=""trg""><p><span class=""iteration"">1</span><span class=""ind"">Clients collectively.</span></p><span class=""indicators""></span><div class=""exg""><div class=""ex""><em>‘the solicitor's clientele’</em></div></div><div class=""synonyms""><div class=""moreInfo""></div><div class=""exg""><div><strong class=""syn"">clients</strong></div></div></div><p><ul class=""subSenses""><li class=""subSense""><span class=""subsenseIteration"">1.1</span><span class=""ind"">The customers of a shop, bar, or place of entertainment.</span><div class=""trg""></div><div class=""exg""><div class=""ex""><em>‘the dancers don't mix with the clientele’</em></div></div><div class=""synonyms""><div class=""moreInfo""></div><div class=""exg""><div><strong class=""syn"">clients</strong></div></div></div></li></ul></p></div></li></ul></section>"
clinch,"<section class=""gramb""><h3 class=""ps pos""><span class=""pos"">verb</span></h3><span class=""transitivity""><span class=""neutral"">[</span>with object<span class=""neutral"">]</span></span><ul class=""semb""><li><div class=""trg""><p><span class=""iteration"">1</span><span class=""ind"">Confirm or settle (a contract or bargain)</span></p><span class=""indicators""></span><div class=""exg""><div class=""ex""><em>‘the Texan wanted to impress him to clinch a business deal’</em></div></div><div class=""synonyms""><div class=""moreInfo""></div><div class=""exg""><div><strong class=""syn"">secure</strong><span class=""syn"">, settle, conclude, close, pull off, bring off, complete, confirm, seal, set the seal on, finalize, shake hands on, reach an agreement on</span></div></div></div><p><ul class=""subSenses""><li class=""subSense""><span class=""subsenseIteration"">1.1</span><span class=""ind"">Conclusively settle (an argument or debate)</span><div class=""trg""></div><div class=""exg""><div class=""ex""><em>‘these findings clinched the matter’</em></div></div><div class=""synonyms""><div class=""moreInfo""></div><div class=""exg""><div><strong class=""syn"">settle</strong><span class=""syn"">, decide, determine, establish</span></div></div></div></li><li class=""subSense""><span class=""subsenseIteration"">1.2</span><span class=""ind"">Confirm the winning or achievement of (a match, competition, or victory)</span><div class=""trg""></div><div class=""exg""><div class=""ex""><em>‘Johnson scored the goals which clinched victory’</em></div></div><div class=""synonyms""><div class=""moreInfo""></div><div class=""exg""><div><strong class=""syn"">win</strong><span class=""syn"">, be the victor in, be the winner of, be victorious in, come first in, finish first in, take first prize in, triumph in, achieve success in, be successful in, prevail in</span></div></div></div></li></ul></p></div></li><li><div class=""trg""><p><span class=""iteration"">2</span><u><span class=""grammatical_note"">no object</span></u> <span class=""ind"">Grapple at close quarters, especially (of boxers) so as to be too closely engaged for full-arm blows.</span></p><span class=""indicators""></span><div class=""synonyms""><div class=""moreInfo""></div><div class=""exg""><div><strong class=""syn"">grapple</strong><span class=""syn"">, wrestle, struggle with each other, scuffle with each other</span></div></div></div><p><ul class=""subSenses""><li class=""subSense""><span class=""subsenseIteration"">2.1</span><span class=""ind"">(of two people) embrace.</span><div class=""trg""></div></li></ul></p></div></li><li><div class=""trg""><p><span class=""iteration"">3</span><span class=""ind"">Secure (a nail or rivet) by driving the point sideways when it has penetrated.</span></p><span class=""indicators""></span><div class=""exg""><div class=""ex""><em>‘After the shoe is nailed on, bring the foot out in front of the horse and put it on a stand or on your knee so you can clinch the nail.’</em></div></div><div class=""exg""><div class=""ex""><em>‘To clinch the nail, it is necessary to hold a heavy metal block against the rib and drive the nail home against this.’</em></div></div><div class=""synonyms""><div class=""moreInfo""></div><div class=""exg""><div><strong class=""syn"">secure</strong><span class=""syn"">, fasten, make fast, fix, clamp, bolt, rivet, pinion</span></div></div></div><p><ul class=""subSenses""><li class=""subSense""><span class=""subsenseIteration"">3.1</span><span class=""ind"">Fasten (a rope or angling line) with a clinch knot.</span><div class=""trg""></div><div class=""exg""><div class=""ex""><em>‘Yeah, the boats weren't clinched down quite tight enough.’</em></div></div><div class=""exg""><div class=""ex""><em>‘This will help the knot clinch down properly and keep it from pulling out or breaking from the spool.’</em></div></div></li></ul></p></div></li></ul></section><hr><section class=""gramb""><h3 class=""ps pos""><span class=""pos"">noun</span></h3><span class=""transitivity""></span><ul class=""semb""><li><div class=""trg""><p><span class=""iteration"">1</span><span class=""ind"">A struggle or scuffle at close quarters.</span></p><span class=""indicators""></span><div class=""exg""><div class=""ex""><em>‘breaking from a clinch, he crossed with his right’</em></div></div><p><ul class=""subSenses""><li class=""subSense""><span class=""subsenseIteration"">1.1</span><span class=""ind"">An embrace, especially an amorous one.</span><div class=""trg""></div><div class=""exg""><div class=""ex""><em>‘we went into a passionate clinch on the sofa’</em></div></div><div class=""synonyms""><div class=""moreInfo""></div><div class=""exg""><div><strong class=""syn"">embrace</strong><span class=""syn"">, hug, cuddle, squeeze, hold, clasp, bear hug</span></div></div></div></li></ul></p></div></li><li><div class=""trg""><p><span class=""iteration"">2</span><div class=""variant"">(also <strong>clinch knot</strong>)</div><span class=""ind"">A knot used to fasten ropes or angling lines, using a half hitch with the end seized back on its own part.</span></p><span class=""indicators""></span><div class=""exg""><div class=""ex""><em>‘The experienced anglers captured the attention of young boys by showing them fishing techniques, including how to tie the perfect clinch knot.’</em></div></div><div class=""exg""><div class=""ex""><em>‘I looked up from the tedious chore of wrapping the improved clinch knot and saw Frazier playing a keeper speckled trout.’</em></div></div></div></li></ul></section>"
